"Title","Authors","Average_Rating","Ratings_Count","Language_Code","Num_Pages","Publication_Date","Publisher","Categories","Text_Reviews_Count","Theme"
"Winter of Magic's Return","Pamela F. Service",4.25,235,"eng",194,1986,"Fawcett","Fantasy.",18,"Fantasy & Science Fiction"
"How to Think Theologically","Howard W. Stone/James O. Duke",3.67,235,"en-US",142,2006,"Fortress Press","Religion",22,"Religious & Spiritual"
"A Full House: An Austin Family Christmas (Austin Family  #5.6)","Madeleine L'Engle/Mary Chambers",3.98,235,"eng",48,2000,"Shaw","Fiction",4,"Fiction"
"Spinoza: A Life","Steven Nadler",4.1,234,"eng",422,2001,"Cambridge University Press","Biography & Autobiography",23,"Biography & Autobiography"
"Walden & Resistance to Civil Government (Critical Edition)","Owen  Thomas/William John Rossi/Henry David Thoreau/William Rossi",3.95,233,"eng",482,1992,"W.W. Norton & Company","Literary Collections",23,"Fiction"
"The Memoirs of Elizabeth Frankenstein","Theodore Roszak",3.56,233,"eng",440,1996,"Bantam","Fiction",24,"Fiction"
"The Portable Arthur Miller","Arthur  Miller/Harold Clurman/Christopher Bigsby",4.21,232,"eng",575,2003,"Penguin Books","Drama",6,"Arts & Culture"
"The Starry Rift","James Tiptree Jr.",3.81,232,"eng",250,1994,"Orb Books","Fiction",25,"Fiction"
"The Crossing","Cormac McCarthy",4.13,232,"eng",425,1996,"Random House Value Publishing","",13,"Other"
"Berserkers: The Beginning (Berserkers  #1 & #5)","Fred Saberhagen",3.7,232,"eng",377,1998,"Baen","Fiction",23,"Fiction"
"Supreme Power: Hyperion","J. Michael Straczynski/Dan Jurgens",3.45,232,"eng",120,2006,"Marvel","Comics & Graphic Novels",9,"Other"
"The Diary of Virginia Woolf  Volume Five: 1936-1941","Virginia Woolf/Anne Olivier Bell/Andrew McNeillie",4.5,231,"eng",424,1985,"Mariner Books","Biography & Autobiography",8,"Biography & Autobiography"
"What are the Seven Wonders of the World?: And 100 Other Great Cultural Lists—Fully Explicated","Peter D'Epiro/Mary Desmond Pinkowish",3.77,231,"eng",560,1998,"Anchor","Reference",19,"Education, Business & Economics"
"Strange Attractors","William Sleator",3.72,230,"eng",176,1991,"Puffin Books","Juvenile Fiction",7,"Young Adult and Children Fiction"
"Great Speeches by African Americans: Frederick Douglass  Sojourner Truth  Dr. Martin Luther King  Jr.  Barack Obama  and Others","James Daley/Barack Obama/Martin Luther King Jr.",4.3,230,"eng",160,2006,"Dover Publications","Social Science",21,"Social Sciences & Philosophy"
"Sounds  Feelings  Thoughts:  Seventy Poems by Wislawa Szymborska","Wisława Szymborska/Magnus J. Kruyski",4.36,229,"eng",232,1981,"Princeton University Press","Poetry",22,"International Literature & Poetry"
"Ovid's Metamorphoses: Books 1-5","Ovid/William Scovil Anderson",4.27,229,"eng",584,1998,"University of Oklahoma Press","Drama",16,"Arts & Culture"
"The Abandoned (Harrow House  #4)","Douglas Clegg",3.45,229,"eng",370,2005,"Leisure Books","Fiction",23,"Fiction"
"Interfictions: An Anthology of Interstitial Writing","Delia Sherman/Theodora Goss/K. Tempest Bradford/Karen Jordan Allen/Rachel Pollack/Veronica Schanoes/Mikal Trimm/Colin Greenland/Vandana Singh/Matthew Cheney/Léa Silhol/Adrián Ferrero/Holly Phillips/Catherynne M. Valente/Christopher Barzak/Leslie What/Anna Tambour/Joy Marchand/Jon Singer/Csilla Kleinheincz/Michael J. DeLuca",3.77,229,"eng",291,2007,"Small Beer Press","Fiction",20,"Fiction"
"Billy Budd  Sailor","Herman Melville/Harrison Hayford/Merton M. Sealts Jr.",3.12,228,"eng",230,2001,"University of Chicago Press","Fiction",26,"Fiction"
"The Night Remembers (Night  #1)","Kathleen Eagle",3.79,228,"eng",355,1998,"HarperTorch","Fiction",25,"Fiction"
"The Warren Buffett Way","Robert G. Hagstrom/Bill Miller/Kenneth L. Fisher",4.13,228,"en-US",245,2005,"John Wiley & Sons","Biography & Autobiography",16,"Biography & Autobiography"
"Storming the Gates of Paradise: Landscapes for Politics","Rebecca Solnit",4.21,228,"en-US",416,2007,"University of California Press","History",30,"History & Historical Fiction"
"Providence of a Sparrow: Lessons from a Life Gone to the Birds","Chris Chester",4.33,228,"eng",304,2004,"Anchor","Biography & Autobiography",44,"Biography & Autobiography"
"The Age of Access: The New Culture of Hypercapitalism  Where All of Life Is a Paid-For Experience","Jeremy Rifkin/Ralph Fowler",3.82,228,"eng",320,2001,"Tarcher","Business & Economics",12,"Education, Business & Economics"
"Seventeen and In-Between","Barthe DeClements",3.81,227,"eng",176,1993,"Puffin","High schools",8,"Education, Business & Economics"
"The Annotated Waste Land with Eliot's Contemporary Prose","T.S. Eliot/Lawrence Rainey",4.11,227,"eng",304,2006,"Yale University Press","Literary Criticism",23,"Fiction"
"Lost City (NUMA Files  #5)","Clive Cussler/Paul Kemprecos",3.9,227,"en-US",515,2005,"G.P. Putnam's Sons","Fiction",17,"Fiction"
"Lies My Teacher Told Me about Christopher Columbus: What Your History Books Got Wrong","James W. Loewen",4,227,"eng",48,2006,"New Press","Education",15,"Education, Business & Economics"
"The Making of a Philosopher: My Journey Through Twentieth-Century Philosophy","Colin McGinn",3.65,226,"eng",256,2003,"Harper Perennial","Philosophy",31,"Social Sciences & Philosophy"
"Love's Executioner  And Other Tales Of Psychotherapy","Irvin D. Yalom",4.21,226,"eng",270,1995,"Penguin Books","Existential psychotherapy",17,"Social Sciences & Philosophy"
"Wanderlust: A History of Walking","Rebecca Solnit",3.92,226,"eng",326,2001,"Penguin Books (London)","Social Science",25,"Social Sciences & Philosophy"
"Phaedrus and Letters VII and VIII","Plato/Walter Hamilton",4.1,226,"en-US",160,1973,"Penguin Classics","Philosophy",20,"Social Sciences & Philosophy"
"Practicalities","Marguerite Duras/Barbara Bray",3.98,226,"eng",143,1993,"Grove Press","Biography & Autobiography",19,"Biography & Autobiography"
"Cat Breaking Free (Joe Grey  #11)","Shirley Rousseau Murphy",4.22,225,"eng",375,2006,"Avon","Fiction",20,"Fiction"
"Reinventing Jesus: How Contemporary Skeptics Miss the Real Jesus and Mislead Popular Culture","J. Ed Komoszewski/Daniel B. Wallace/M. James Sawyer",4.2,225,"en-US",347,2006,"Kregel Publications","Religion",21,"Religious & Spiritual"
"The Role of the Reader: Explorations in the Semiotics of Texts","Umberto Eco",4.06,224,"eng",288,1979,"Indiana University Press","Literary Criticism",5,"Fiction"
"The Sultan's Bought Bride  (Princess Brides  #1)","Jane Porter",3.74,224,"eng",192,2004,"Harlequin Presents","Fiction",20,"Fiction"
"The Trouble With Violet","Anne Mazer/Bill Brown",3.89,223,"eng",112,2007,"Scholastic Paperbacks","Juvenile Fiction",36,"Young Adult and Children Fiction"
"This Is Push: New Stories from the Edge","David Levithan/Patricia McCormick/Matthue Roth/Kevin Waltman/Samantha Schutz/Coe Booth/Eddie de Oliveira/Tanuja Desai Hidier/Kevin Brooks/Chris Wooding/Markus Zusak/Brian James/Kristen Kemp/Eireann Corrigan/Christopher Krovatin/Billy Merrell",3.63,223,"eng",240,2007,"Push","Juvenile Fiction",23,"Young Adult and Children Fiction"
"Legends  Lies  Cherished Myths of World History","Richard Shenkman",3.47,222,"eng",320,2011,"William Morrow Paperbacks","History",16,"History & Historical Fiction"
"The Visible Hand: The Managerial Revolution in American Business","Alfred D. Chandler Jr.",4.01,222,"en-US",624,1977,"Belknap Press","Business & Economics",26,"Education, Business & Economics"
"The Organized Student: Teaching Children the Skills for Success in School and Beyond","Donna Goldberg/Jennifer Zwiebel",3.82,222,"en-US",246,2005,"Touchstone","Family & Relationships",26,"Health, Personal Development & Relationships"
"Never Go Home Again","Shannon Holmes",4.03,222,"eng",336,2005,"Atria Books","Fiction",11,"Fiction"
"The Virtues of Aging","Jimmy Carter",3.55,221,"eng",160,1998,"Ballantine Books","Biography & Autobiography",36,"Biography & Autobiography"
"McNally's Alibi (Archy McNally Novels)","Vincent Lardo/Lawrence Sanders",3.9,221,"eng",304,2003,"Berkley","Fiction",4,"Fiction"
"For the Sake of Argument: Essays and Minority Reports","Christopher Hitchens",4.16,221,"en-GB",368,1994,"Verso","Literary Collections",9,"Fiction"
"Amazing Disgrace (Gerald Samper #2)","James Hamilton-Paterson",3.8,221,"eng",320,2006,"Europa Editions","Fiction",34,"Fiction"
"Vincent Van Gogh: Portrait of an Artist","Jan Greenberg/Sandra Jordan",3.94,220,"eng",144,2003,"Yearling","Juvenile Nonfiction",38,"Young Adult and Children Fiction"
"The World of Peter Rabbit (Original Peter Rabbit  Books 1-23)","Beatrix Potter",4.62,220,"eng",1072,2006,"Warne","Juvenile Fiction",14,"Young Adult and Children Fiction"
"A Friar's Bloodfeud (Knights Templar  #20)","Michael Jecks",4.1,220,"eng",500,2006,"Headline","Fiction",14,"Fiction"
"More Plums in One (Stephanie Plum  #4-6)","Janet Evanovich",4.45,219,"en-US",792,2007,"St. Martin's Press","Fiction",11,"Fiction"
"Hamlet in Purgatory","Stephen Greenblatt",3.94,219,"eng",344,2002,"Princeton University Press","Drama",24,"Arts & Culture"
"From Far Away","Robert Munsch/Michael Martchenko/Saoussan Askar",4,219,"eng",33,1995,"Annick Press","Juvenile Fiction",21,"Young Adult and Children Fiction"
"The Purpose of Your Life: Finding Your Place In The World Using Synchronicity  Intuition  And Uncommon Sense","Carol Adrienne/James Redfield",3.76,218,"eng",320,1999,"William Morrow Paperbacks","Body, Mind & Spirit",27,"Health, Personal Development & Relationships"
"The Elements of Style","William Strunk Jr./E.B. White",4.19,217,"en-US",85,1991,"MacMillan Publishing Company","Language Arts & Disciplines",16,"Education, Business & Economics"
"Walt Whitman: A Life","Justin Kaplan",3.99,217,"eng",464,2003,"Harper Perennial Modern Classics","Biography & Autobiography",17,"Biography & Autobiography"
"The Christians and the Fall of Rome (Great Ideas)","Edward Gibbon",3.56,217,"en-US",96,2005,"Penguin","History",20,"History & Historical Fiction"
"The Pirates Laffite: The Treacherous World of the Corsairs of the Gulf","William C. Davis",3.5,217,"eng",756,2006,"Mariner Books","Biography & Autobiography",37,"Biography & Autobiography"
"Intimate Journals","Charles Baudelaire/Christopher Isherwood/W.H. Auden",3.73,217,"eng",128,2006,"Dover Publications","Literary Collections",27,"Fiction"
"A Picture Book of Anne Frank","David A. Adler/Karen Ritz",4.18,217,"en-US",32,1993,"Holiday House","Juvenile Nonfiction",70,"Young Adult and Children Fiction"
"Shaken (Left Behind: The Kids  #23-25)","Jerry B. Jenkins/Tim LaHaye/Chris Fabry",4.32,217,"eng",384,2005,"Tyndale House Publishers","Juvenile Fiction",2,"Young Adult and Children Fiction"
"The Flash: Dead Heat","Mark Waid/Oscar Jimenez/Humberto Ramos/José Marzán Jr./Wayne Faucher",3.93,216,"eng",144,2000,"DC Comics","Juvenile Fiction",10,"Young Adult and Children Fiction"
"The Oresteia","Aeschylus/Ted Hughes",4.02,215,"en-US",208,2004,"Farrar  Straus and Giroux","Drama",25,"Arts & Culture"
"Civilization and Its Discontents","Sigmund Freud/Louis Menand",3.78,215,"eng",192,2005,"W. W. Norton  Company","History",18,"History & Historical Fiction"
"Grizzwold","Syd Hoff",3.82,214,"eng",64,1984,"HarperCollins","Juvenile Fiction",23,"Young Adult and Children Fiction"
"Thorn in Her Side (The Princess School  #7)","Jane B. Mason/Sarah Hines Stephens",3.88,214,"eng",144,2006,"Scholastic Paperbacks","Juvenile Fiction",8,"Young Adult and Children Fiction"
"Nonfiction","Chuck Palahniuk",3.57,213,"eng",233,2004,"Jonathan Cape","Curiosities and wonders",15,"Social Sciences & Philosophy"
"The Coming Economic Collapse: How You Can Thrive When Oil Costs $200 a Barrel","Stephen Leeb/Glen C. Strathy",3.4,213,"en-US",211,2006,"Business Plus","Business & Economics",26,"Education, Business & Economics"
"Perfect Match","Jodi Picoult",3.95,213,"eng",368,2002,"Atria Books","Fiction",33,"Fiction"
"The Twelve Steps & Twelve Traditions of Overeaters Anonymous","Overeaters Anonymous",4.36,213,"en-US",221,1993,"Overeaters Anonymous  Incorporated","Self-Help",10,"Health, Personal Development & Relationships"
"Collected Poems","Chinua Achebe",3.74,213,"eng",84,2009,"Anchor Books","Poetry",25,"International Literature & Poetry"
"The Right Stuff","Tom Wolfe",4.24,213,"eng",304,2005,"Black Dog & Leventhal","Biography & Autobiography",24,"Biography & Autobiography"
"Aquinas's Shorter Summa: Saint Thomas's Own Concise Version of His Summa Theologica","Thomas Aquinas",4.14,213,"eng",412,2005,"Sophia Institute Press","Religion",8,"Religious & Spiritual"
"The Non-Designer's Web Book","Robin P. Williams/John Tollett",3.66,212,"en-US",335,2005,"Peachpit Press","Computers",19,"Technology, Science & Animals"
"The Hitchhiker's Guide to the Galaxy (Hitchhiker's Guide  #1)","Douglas Adams",4.22,212,"eng",271,2004,"Crown Publishing Group (NY)","Fiction",18,"Fiction"
"Letters","John Barth",3.81,212,"eng",772,1994,"Dalkey Archive Press","Fiction",15,"Fiction"
"Orwell in Spain: The Full Text of Homage to Catalonia  with Associated Articles  Reviews and Letters from the Complete Works of George Orwell","George Orwell/Christopher Hitchens",4.14,211,"eng",416,2001,"Penguin Classics","Fiction",16,"Fiction"
"Unacknowledged Legislation: Writers in the Public Sphere","Christopher Hitchens",4.01,211,"eng",430,2002,"Verso","Literary Collections",16,"Fiction"
"Ragtime","E.L. Doctorow",3.88,210,"eng",369,1977,"Bantam Books","New York (State)",37,"Travel & Places"
"How to Win Friends and Influence People","Dale Carnegie",4.19,210,"en-US",256,1994,"Cedar Books","Conduct of life",21,"Health, Personal Development & Relationships"
"The Scotch-Irish: A Social History","James Graham Leyburn",3.97,210,"eng",377,1989,"University of North Carolina Press","History",25,"History & Historical Fiction"
"The Grand Inquisitor: with related chapters from The Brothers Karamazov","Fyodor Dostoyevsky/Constance Garnett/Charles Guignon",4.36,210,"eng",128,1993,"Hackett Publishing Company  Inc.","Political Science",14,"Education, Business & Economics"
"Ballet Shoes","Noel Streatfeild",4.07,210,"eng",184,2004,"Orion Children's Books","Ballet",26,"Arts & Culture"
"Star Wars:  The New Essential Guide to Vehicles & Vessels","W. Haden Blackman/Ian Fullwood",4.12,209,"eng",200,2003,"Del Rey","Performing Arts",7,"Arts & Culture"
"The Stories (So Far)","Deborah Eisenberg",4,209,"eng",496,1997,"Farrar  Straus and Giroux","Fiction",19,"Fiction"
"The Bush Dyslexicon: Observations on a National Disorder","Mark Crispin Miller",3.56,209,"eng",370,2002,"W. W. Norton  Company","Biography & Autobiography",19,"Biography & Autobiography"
"The Boomer Bible","R.F. Laird",4.23,209,"eng",880,1991,"Workman Publishing Company","Humor",28,"Fiction"
"50 Great Curries of India","Camellia Panjabi",4.15,209,"eng",224,2005,"Kyle Books","Cooking",29,"Health, Personal Development & Relationships"
"Lights Out","Peter Abrahams",3.65,208,"eng",352,2002,"Fawcett Books","Fiction",16,"Fiction"
"The Coming of the Fairies","Arthur Conan Doyle/John M. Lynch",3.39,208,"eng",189,2006,"Bison Books","Fiction",38,"Fiction"
"Saint-Exupéry","Stacy Schiff/Antoine de Saint-Exupéry",4.02,208,"eng",560,2006,"Holt Paperbacks","Biography & Autobiography",27,"Biography & Autobiography"
"Serious Girls","Maxine Swann",3.2,207,"eng",240,2004,"Picador USA","Fiction",28,"Fiction"
"Little Miss Birthday","Roger Hargreaves/Adam Hargreaves",4.02,207,"eng",32,2007,"Price Stern Sloan","Juvenile Fiction",11,"Young Adult and Children Fiction"
"Collected Tales  Sketches  Speeches  & Essays 1891–1910","Mark Twain/Louis J. Budd",4.39,207,"eng",1050,1992,"Library of America","Humorous stories, American",10,"Other"
"Diabolo: Volume 1","Kei Kusunoki/Kaoru Ohashi",3.46,207,"en-US",199,2004,"TokyoPop","Comics & Graphic Novels",9,"Other"
"The Best American Crime Writing 2006","Mark Bowden/Otto Penzler/Thomas H. Cook/S.C. Gwynne/Paige Williams/Mary Battiata/Howard Blum/John Connolly/Richard Rubin/Chuck Hustmyre/David Friedman/Denise Grollmus/Deanne Stillman/Jeffrey Toobin/Skip Hollandsworth/Jimmy Breslin/John Heilemann/Mark Jacobson/Robert Nelson",4,206,"eng",352,2006,"Ecco","True Crime",18,"Mystery & Detective"
"The Rainbow People","Laurence Yep/David Wiesner",3.75,206,"eng",208,1992,"HarperCollins","Juvenile Fiction",47,"Young Adult and Children Fiction"
"Cast a Yellow Shadow (Mac McCorkle  #2)","Ross Thomas",3.95,206,"eng",272,1987,"Mysterious Press","Fiction",17,"Fiction"
"The Porcelain Dove","Delia Sherman",3.41,206,"eng",416,1994,"Plume","Fiction",28,"Fiction"
"Spock: The Fire and the Rose (Star Trek: Crucible  #2)","David R. George III",3.96,206,"eng",390,2006,"Pocket Books","Fiction",14,"Fiction"
"Immigrant Acts: On Asian American Cultural Politics","Lisa Lowe",4,206,"eng",272,1996,"Duke University Press Books","Social Science",9,"Social Sciences & Philosophy"
"Daniel Deronda","George Eliot/Earl L. Dachslager/George Stade",3.84,206,"eng",784,2005,"Barnes  Noble Classics","Fiction",47,"Fiction"
"Presocratic Philosophy: A Very Short Introduction","Catherine Osborne",3.58,205,"eng",144,2004,"Oxford University Press  USA","Philosophy",24,"Social Sciences & Philosophy"
"The Church on the Other Side: Doing Ministry in the Postmodern Matrix","Brian D. McLaren",3.58,205,"eng",224,2003,"Zondervan","Religion",10,"Religious & Spiritual"
"The Star Wars Cookbook II: Darth Malt and More Galactic Recipes","Wesley Martin/Frankie Frankeny",3.86,205,"eng",60,2000,"Chronicle Books","Cooking",15,"Health, Personal Development & Relationships"
"The Great Wave: Price Revolutions and the Rhythm of History","David Hackett Fischer",3.97,204,"eng",552,1999,"Oxford University Press  USA","Business & Economics",33,"Education, Business & Economics"
"Introduction to Documentary","Bill Nichols",3.79,204,"en-US",248,2001,"Indiana University Press","Performing Arts",5,"Arts & Culture"
"Four Mothers","Shifra Horn/Dalya Bilu",3.69,204,"eng",276,2000,"Picador","Fiction",28,"Fiction"
"Mediterranean Winter: The Pleasures of History and Landscape in Tunisia  Sicily  Dalmatia and the Peloponnese","Robert D. Kaplan",3.92,204,"eng",272,2005,"Vintage/Random House (NY)","Travel",26,"Travel & Places"
"100 Great Fantasy Short Short Stories","Isaac Asimov/Terry Carr/Martin H. Greenberg/Janet  Fox",3.91,204,"eng",395,1985,"Avon","Fiction",19,"Fiction"
"Talk to the Hand: The Utter Bloody Rudeness of Everyday Life","Lynne Truss",3.33,204,"eng",214,2005,"Profile Books","Conduct of life",30,"Health, Personal Development & Relationships"
"Love Letters","Kahlil Gibran/Suheil Bushrui/Salma H. Al-Kuzbari",3.68,203,"eng",178,1999,"One World (UK)","Biography & Autobiography",8,"Biography & Autobiography"
"The Franco-Prussian War","Michael Eliot Howard",4.09,202,"eng",532,2001,"Routledge/Taylor & Francis Ltd.","Foreign Language Study",13,"Education, Business & Economics"
"The Chronicles of Narnia CD Box Set","C.S. Lewis/Kenneth Branagh",4.26,202,"eng",31,2004,"HarperFestival","Juvenile Fiction",24,"Young Adult and Children Fiction"
"The Presocratics","Philip Ellis Wheelwright",4.04,201,"en-US",352,1966,"Prentice Hall/Library of Liberal Arts","Philosophy",12,"Social Sciences & Philosophy"
"Lost Stories","Dashiell Hammett/Vince Emery/Joe Gores",3.98,201,"eng",342,2005,"Vince Emery Productions","",37,"Other"
"Forgotten New York: Views of a Lost Metropolis","Kevin   Walsh",4.16,200,"eng",384,2006,"Collins Reference","Travel",20,"Travel & Places"
"The Chosen: The Hidden History of Admission and Exclusion at Harvard  Yale  and Princeton","Jerome Karabel",4.08,200,"eng",736,2006,"Mariner Books","Education",22,"Education, Business & Economics"
"What Life Was Like on the Banks of the Nile: Egypt  3050-30 BC","Denise Dersin",4,199,"eng",192,1999,"Time Life Books","Egypt",17,"Travel & Places"
"The End of Nana Sahib: The Steam House (Extraordinary Voyages  #20)","Jules Verne/Agnes D. Kingston",3.59,199,"eng",276,2003,"Fredonia Books (NL)","Fiction",9,"Fiction"
"Rodinsky's Room","Rachel Lichtenstein/Iain Sinclair",3.85,199,"eng",362,2000,"Granta UK","Biography & Autobiography",19,"Biography & Autobiography"
"Goodnight Moon 123: A Counting Book (Over the Moon)","Margaret Wise Brown/Clement Hurd",3.57,198,"eng",32,2007,"HarperCollins Publishers","Juvenile Fiction",22,"Young Adult and Children Fiction"
"Complete Poems (Library of Classic Poets)","Edgar Allan Poe",4.17,198,"en-US",128,2001,"Gramercy","Poetry",11,"International Literature & Poetry"
"Switch on the Night","Ray Bradbury/Leo Dillon/Diane Dillon",4.13,198,"en-US",40,2004,"Dragonfly Books","Juvenile Fiction",12,"Young Adult and Children Fiction"
"The World  the Text  and the Critic","Edward W. Said/إدوارد سعيد",4.18,198,"eng",336,2006,"Harvard University Press","Literary Criticism",6,"Fiction"
"The Weimar Republic: The Crisis of Classical Modernity","Detlev J.K. Peukert/Richard Deveson",3.84,198,"eng",360,1993,"Hill and Wang","History",11,"History & Historical Fiction"
"Complete Stories 1892–1898","Henry James/John Hollander/David Bromwich",4.22,198,"eng",958,1996,"Library of America","Literary Collections",7,"Fiction"
"Hemingway: A Biography","Jeffrey Meyers",4,197,"eng",644,1999,"Da Capo Press","Literary Collections",15,"Fiction"
"Chester","Syd Hoff",3.74,196,"eng",64,1986,"HarperCollins","Juvenile Fiction",31,"Young Adult and Children Fiction"
"Dazzling Brightness (Greek Myths  #1)","Roberta Gellis",3.84,196,"eng",446,1994,"Pinnacle","Fiction",16,"Fiction"
"Cults in Our Midst: The Continuing Fight Against Their Hidden Menace","Margaret Thaler Singer/Robert Jay Lifton",3.95,196,"eng",432,2003,"Jossey-Bass","Psychology",25,"Social Sciences & Philosophy"
"The Undead and Philosophy: Chicken Soup for the Soulless","Richard V. Greene/K. Silem Mohammad",3.7,196,"en-US",288,2006,"Open Court","Philosophy",18,"Social Sciences & Philosophy"
"The Complete Essays of Mark Twain","Mark Twain/Charles Neider",4.33,195,"eng",732,2000,"Da Capo Press","Literary Collections",15,"Fiction"
"The Dream Kingdom (The Morland Dynasty  #26)","Cynthia Harrod-Eagles",4.34,195,"eng",640,2004,"Little  Brown Book Group","Fiction",7,"Fiction"
"The White Road (Morland Dynasty  #28)","Cynthia Harrod-Eagles",4.27,195,"eng",480,2006,"Little  Brown Book Group","Fiction",8,"Fiction"
"Secret Identity (Lost  #2)","Catherine Hapka",2.93,195,"eng",176,2006,"Voice","Fiction",11,"Fiction"
"Vegas Bites: A Werewolf Romance Anthology","L.A. Banks/J.M. Jeffries/Seressie Glass/Natalie Dunbar",4.12,195,"en-US",346,2006,"Parker Publishing Llc","Fiction",6,"Fiction"
"How to Breathe Underwater","Julie Orringer",3.96,194,"eng",222,2005,"Penguin","Families",34,"Health, Personal Development & Relationships"
"The Truth of the Matter","Robb Forman Dew",3.09,194,"eng",352,2006,"Back Bay Books","Fiction",40,"Fiction"
"The Mantle of Kendis-Dai (Starshield  #1)","Margaret Weis/Tracy Hickman",3.57,194,"eng",353,1997,"Del Rey Fantasy","Fiction",7,"Fiction"
"Stay!: Keeper's Story","Lois Lowry/True Kelley",3.93,194,"eng",128,1999,"Yearling","Juvenile Fiction",32,"Young Adult and Children Fiction"
"Heathersleigh Homecoming (Secrets of Heathersleigh Hall  #3)","Michael R. Phillips",4.33,194,"eng",429,1999,"Bethany House Publishers","Fiction",15,"Fiction"
"One Matchless Time: A Life of William Faulkner","Jay Parini",3.97,193,"en-US",528,2005,"Harper Perennial","Biography & Autobiography",34,"Biography & Autobiography"
"Dealing in Futures","Joe Haldeman",3.73,193,"en-US",352,1993,"Roc","Fiction",12,"Fiction"
"No Heroes: A Memoir of Coming Home","Chris Offutt",3.87,193,"eng",272,2003,"Simon  Schuster","Biography & Autobiography",34,"Biography & Autobiography"
"The Count of Monte Cristo","Alexandre Dumas/Brantley Johnson/Margaret Brantley",4.25,193,"eng",620,2004,"Simon  Schuster","Fiction",26,"Fiction"
"On the Bus: The Complete Guide to the Legendary Trip of Ken Kesey and the Merry Pranksters and the Birth of Counterculture","Paul Perry/Ken Babbs",3.86,193,"eng",205,1997,"Running Press","Social Science",10,"Social Sciences & Philosophy"
"The Best of America's Test Kitchen 2007: The Year's Best Recipes  Equipment Reviews  and Tastings","America's Test Kitchen",4.35,193,"eng",312,2006,"America's Test Kitchen","Cooking",7,"Health, Personal Development & Relationships"
"Let the Hurricane Roar","Rose Wilder Lane",3.96,192,"en-US",118,1985,"HarperTrophy","Families",32,"Health, Personal Development & Relationships"
"Lord Malquist and Mr. Moon","Tom Stoppard",3.41,192,"eng",200,2006,"Grove Press","Fiction",23,"Fiction"
"Boogaloo on 2nd Avenue","Mark Kurlansky",3.17,191,"eng",319,2006,"Random House Trade","Fiction",26,"Fiction"
"The Church in Emerging Culture: Five Perspectives","Leonard Sweet/Brian D. McLaren/Erwin Raphael McManus/Michael S. Horton/Frederica Matthewes-Green/Andy Crouch",3.36,190,"eng",272,2003,"Zondervan","Religion",6,"Religious & Spiritual"
"The Littles and Their Amazing New Friend","John Lawrence Peterson",3.87,190,"eng",112,1999,"Scholastic Paperbacks","Juvenile Fiction",16,"Young Adult and Children Fiction"
"Every Good Boy Deserves Favor & Professional Foul","Tom Stoppard",3.9,190,"en-GB",188,1994,"Grove Press","Drama",10,"Arts & Culture"
"Outsiders Within: Writing on Transracial Adoption","Jane Jeong Trenka/Julia Chinyere Oparah",4.17,190,"eng",300,2006,"South End Press","Education",20,"Education, Business & Economics"
"The Real Trial of Oscar Wilde","Merlin Holland",4.04,189,"eng",384,2004,"Harper Perennial","Biography & Autobiography",14,"Biography & Autobiography"
"Egyptian Myth: A Very Short Introduction","Geraldine Pinch",3.61,189,"eng",143,2004,"Oxford University Press  USA","History",18,"History & Historical Fiction"
"Does Anybody Have a Problem With That? The Best of Politically Incorrect","Bill Maher",3.51,189,"eng",288,1997,"Ballantine Books","Humor",9,"Fiction"
"Cross-X","Joe  Miller",3.8,189,"eng",480,2006,"Farrar Straus Giroux","Social Science",40,"Social Sciences & Philosophy"
