"Title","Authors","Average_Rating","Ratings_Count","Language_Code","Num_Pages","Publication_Date","Publisher","Categories","Text_Reviews_Count","Theme"
"Obasan","Joy Kogawa",3.64,5407,"eng",320,1993,"Anchor Books","Fiction",368,"Fiction"
"The Secret Lives of Men and Women: A PostSecret Book","Frank Warren",4.37,5406,"en-GB",144,2007,"William Morrow","Self-Help",237,"Health, Personal Development & Relationships"
"Night Falls Fast: Understanding Suicide","Kay Redfield Jamison",4.1,5382,"eng",432,2000,"Vintage","",224,"Other"
"My Gal Sunday","Mary Higgins Clark",3.57,5355,"en-US",206,2003,"Pocket Books","Fiction",183,"Fiction"
"Reefer Madness: Sex  Drugs  and Cheap Labor in the American Black Market","Eric Schlosser",3.78,5330,"eng",352,2004,"Mariner Books","Business & Economics",353,"Education, Business & Economics"
"Lila: An Inquiry Into Morals (Phaedrus  #2)","Robert M. Pirsig",3.78,5317,"eng",480,1992,"Bantam","Education",291,"Education, Business & Economics"
"Lafcadio  the Lion Who Shot Back","Shel Silverstein",4.15,5308,"eng",112,2013,"HarperCollins","Juvenile Fiction",307,"Young Adult and Children Fiction"
"Emotionally Weird","Kate Atkinson",3.45,5308,"eng",368,2001,"Picador","Fiction",482,"Fiction"
"Easy Riders  Raging Bulls","Peter Biskind",4.12,5305,"eng",512,1999,"Simon  Schuster","Performing Arts",341,"Arts & Culture"
"Amelia's Notebook (Amelia's Notebooks  #1)","Marissa Moss",4.01,5305,"eng",40,2006,"Simon  Schuster/Paula Wiseman Books","Juvenile Fiction",166,"Young Adult and Children Fiction"
"The 42nd Parallel (U.S.A.  #1)","John Dos Passos",3.82,5290,"eng",326,2000,"Mariner Books","Fiction",321,"Fiction"
"Summer Crossing","Truman Capote",3.44,5274,"eng",142,2006,"Modern Library","Fiction",428,"Fiction"
"Bad Astronomy","Philip Plait",4.04,5247,"eng",277,2002,"Wiley","Science",234,"Technology, Science & Animals"
"The Gettysburg Address","Abraham Lincoln/Michael McCurdy",4.53,5239,"eng",32,1998,"HMH Books for Young Readers","Juvenile Nonfiction",76,"Young Adult and Children Fiction"
"A Circle of Quiet (Crosswicks Journals #1)","Madeleine L'Engle",4.21,5236,"en-CA",246,1984,"HarperOne","Religion",506,"Religious & Spiritual"
"Riding the Bus with My Sister: A True Life Journey","Rachel Simon",3.76,5226,"eng",304,2003,"Plume","Biography & Autobiography",771,"Biography & Autobiography"
"The Secret Diary of Anne Boleyn","Robin Maxwell",3.8,5221,"eng",281,1998,"Atria Books","Fiction",299,"Fiction"
"Chester's Way","Kevin Henkes",4.22,5218,"eng",32,1997,"Greenwillow Books","Juvenile Fiction",294,"Young Adult and Children Fiction"
"The Tale of the Flopsy Bunnies","Beatrix Potter",4.19,5209,"eng",58,2002,"Warne","Juvenile Nonfiction",130,"Young Adult and Children Fiction"
"Fools Die","Mario Puzo",3.72,5197,"eng",544,1979,"Signet","Fiction",215,"Fiction"
"The Labyrinth of Solitude and Other Writings","Octavio Paz/Lysander Kemp/Yara Milos",4.14,5170,"eng",398,1994,"Grove Press","History",154,"History & Historical Fiction"
"Spiritual Midwifery","Ina May Gaskin",4.38,5166,"eng",482,2002,"Book Publishing Company (TN)","Medical",429,"Technology, Science & Animals"
"Personal Injuries (Kindle County Legal Thriller #5)","Scott Turow",3.86,5163,"eng",528,2000,"Warner Books (NY)","Fiction",179,"Fiction"
"The Brief and Frightening Reign of Phil","George Saunders",3.7,5157,"eng",130,2005,"Riverhead Books","Fiction",553,"Fiction"
"This Rough Magic","Mary  Stewart",4.05,5153,"eng",373,2004,"HarperTorch","Fiction",327,"Fiction"
"A Midwife's Tale: The Life of Martha Ballard  Based on Her Diary  1785-1812","Laurel Thatcher Ulrich",4.01,5149,"eng",444,1991,"Vintage Books","Biography & Autobiography",633,"Biography & Autobiography"
"The Road to Gandolfo","Robert Ludlum/Michael  Shepherd",3.64,5141,"eng",320,1992,"Bantam","Fiction",160,"Fiction"
"Blade of Fortriu (The Bridei Chronicles  #2)","Juliet Marillier",4.09,5141,"eng",496,2006,"Tor","Fiction",184,"Fiction"
"Palm Sunday: An Autobiographical Collage","Kurt Vonnegut Jr.",3.77,5135,"eng",300,1999,"Dial Press","Biography & Autobiography",192,"Biography & Autobiography"
"Triple Zero  (Star Wars: Republic Commando  #2)","Karen Traviss",4.24,5130,"eng",393,2006,"Del Rey Books","Fiction",163,"Fiction"
"Runaways (Orphans  #5)","V.C. Andrews",3.77,5121,"eng",342,1998,"Pocket Books","Fiction",78,"Fiction"
"The House of Morgan: An American Banking Dynasty and the Rise of Modern Finance","Ron Chernow",4.07,5110,"eng",812,2001,"Grove Press","Biography & Autobiography",281,"Biography & Autobiography"
"The Last Shot: City Streets  Basketball Dreams","Darcy Frey",4.17,5106,"en-CA",233,2004,"Mariner Books","Sports & Recreation",155,"Health, Personal Development & Relationships"
"The Story of a Seagull and the Cat Who Taught Her to Fly","Luis Sepúlveda/Chris Sheban/Margaret Sayers Peden",4.14,5097,"eng",128,2006,"Scholastic Paperbacks","Juvenile Fiction",219,"Young Adult and Children Fiction"
"Phenomenology of Perception","Maurice Merleau-Ponty/Colin Smith",4.15,5078,"eng",544,2005,"Routledge","Philosophy",77,"Social Sciences & Philosophy"
"Octopussy & the Living Daylights (James Bond  #14)","Ian Fleming",3.55,5074,"eng",120,2004,"Penguin Books","Fiction",211,"Fiction"
"Reversible Errors (Kindle County Legal Thriller #6)","Scott Turow",3.83,5073,"eng",553,2003,"Warner Vision","Fiction",222,"Fiction"
"Sector 7","David Wiesner",4.21,5066,"eng",48,1999,"Clarion Books","Juvenile Fiction",523,"Young Adult and Children Fiction"
"Lost in the Funhouse","John Barth",3.7,5052,"eng",205,1988,"Anchor Books","Fiction",305,"Fiction"
"The Dream Giver","Bruce H. Wilkinson/David Kopp/Heather Harpham Kopp",4.26,5044,"eng",157,2003,"Multnomah Books","Religion",316,"Religious & Spiritual"
"A Primate's Memoir: A Neuroscientist's Unconventional Life Among the Baboons","Robert M. Sapolsky",4.35,5040,"eng",304,2002,"Scribner","Nature",590,"Technology, Science & Animals"
"New Rules: Polite Musings from a Timid Observer","Bill Maher",3.71,5034,"en-US",304,2005,"Rodale Books","Humor",305,"Fiction"
"Sophocles II: Ajax/Women of Trachis/Electra/Philoctetes (Complete Greek Tragedies 4)","Sophocles/David Grene/Richmond Lattimore/John Moore/Michael Jameson",4.14,5032,"eng",254,1969,"University of Chicago Press","",36,"Other"
"Sprig Muslin","Georgette Heyer",3.81,5030,"eng",268,2005,"Arrow","England",406,"Travel & Places"
"Touch Not the Cat","Mary  Stewart",3.91,5029,"eng",372,2005,"HarperTorch","Fiction",282,"Fiction"
"Wings of Fire (Inspector Ian Rutledge  #2)","Charles Todd",3.99,5029,"eng",323,1999,"St. Martin's Paperbacks","Fiction",438,"Fiction"
"The Gap Into Vision: Forbidden Knowledge (Gap  #2)","Stephen R. Donaldson",3.99,5020,"en-US",480,2010,"Bantam","Fiction",101,"Fiction"
"A Sparrow Falls (Courtney #3)","Wilbur Smith",4.19,5019,"eng",640,2007,"St. Martin's Paperbacks","Fiction",91,"Fiction"
"The Art of Fiction: Notes on Craft for Young Writers","John Gardner",4,5019,"eng",224,1991,"Vintage","Language Arts & Disciplines",408,"Education, Business & Economics"
"The Risk Pool","Richard Russo",4.04,5013,"eng",479,1998,"Vintage","Families",332,"Health, Personal Development & Relationships"
"The Book of Imaginary Beings","Jorge Luis Borges/Margarita Guerrero/Peter Sís/Andrew Hurley",4.09,5007,"eng",236,2006,"Penguin Books","Fiction",238,"Fiction"
"Davita's Harp","Chaim Potok",3.99,5005,"eng",371,1996,"Ballantine Books","Fiction",314,"Fiction"
"I Married a Communist (The American Trilogy  #2)","Philip Roth",3.81,4996,"eng",323,1999,"Vintage","Fiction",325,"Fiction"
"Muhammad: A Biography of the Prophet","Karen Armstrong",4.15,4978,"eng",304,1993,"HarperOne","Biography & Autobiography",258,"Biography & Autobiography"
"Seven Plays","Sam Shepard/Richard Gilman",4.18,4967,"eng",336,1984,"Dial Press Trade Paperback","Drama",105,"Arts & Culture"
"The Simple Art of Murder","Raymond Chandler",4.16,4952,"eng",384,1988,"Vintage Crime/Black Lizard","Fiction",162,"Fiction"
"Company","Max Barry",3.73,4938,"eng",338,2007,"Vintage","Fiction",404,"Fiction"
"The Real Frank Zappa Book","Frank Zappa/Peter Occhiogrosso",4.13,4934,"eng",352,1990,"Picador USA","Rock musicians",223,"Arts & Culture"
"Beauty and Sadness","Yasunari Kawabata/Howard Hibbett",3.85,4933,"eng",206,1996,"Vintage","Fiction",313,"Fiction"
"Youth","J.M. Coetzee",3.79,4931,"eng",176,2003,"Penguin Books","Fiction",261,"Fiction"
"The Hitchhiker's Guide to the Galaxy (Hitchhiker's Guide to the Galaxy  #1)","Douglas Adams",4.22,4930,"eng",215,2004,"Crown","Fiction",460,"Fiction"
"The Working Poor: Invisible in America","David K. Shipler",4.03,4929,"eng",352,2005,"Vintage","Social Science",369,"Social Sciences & Philosophy"
"The Mystery at the Moss-covered Mansion (Nancy Drew Mystery Stories  #18)","Carolyn Keene/Russell H. Tandy/Mildred Benson",3.89,4920,"eng",215,2003,"Applewood Books","Juvenile Fiction",95,"Young Adult and Children Fiction"
"Confessions","Jean-Jacques Rousseau/Patrick Coleman/Angela Scholar",3.62,4919,"eng",676,2000,"Oxford University Press","Literary Criticism",160,"Fiction"
"Code","Charles Petzold",4.39,4919,"eng",400,2000,"Microsoft Press","Computers",418,"Technology, Science & Animals"
"Deception Point","Dan Brown",3.71,4919,"eng",736,2006,"Pocket Books","Fiction",410,"Fiction"
"The King of Elfland's Daughter","Lord Dunsany/Neil Gaiman",3.84,4918,"eng",240,1999,"Del Rey","Fiction",427,"Fiction"
"The Lord of the Rings and Philosophy: One Book to Rule Them All","Gregory Bassham/Eric Bronson",4.28,4913,"eng",240,2003,"Open Court","Literary Criticism",40,"Fiction"
"Night of the Fox (Dougal Munro and Jack Carter #1)","Jack Higgins",3.92,4908,"eng",352,2008,"Pocket Books","Fiction",89,"Fiction"
"Shōgun (Asian Saga  #1)","James Clavell",4.39,4902,"eng",1152,1999,"Hodder & Stoughton","British",299,"Biography & Autobiography"
"Jacques the Fatalist","Denis Diderot/David Coward",3.84,4891,"eng",304,1999,"Oxford University Press","Fiction",102,"Fiction"
"The Manhattan Hunt Club","John Saul",3.98,4889,"eng",384,2006,"Ballantine Books","Fiction",221,"Fiction"
"What Jane Austen Ate and Charles Dickens Knew: From Fox Hunting to Whist—the Facts of Daily Life in 19th-Century England","Daniel Pool",3.85,4873,"en-US",416,1994,"Touchstone","Education",501,"Education, Business & Economics"
"King Arthur Flour Whole Grain Baking: Delicious Recipes Using Nutritious Whole Grains","King Arthur Flour",4.13,4866,"eng",544,2006,"Countryman Press","Cooking",78,"Health, Personal Development & Relationships"
"Frogs & French Kisses (Magic in Manhattan  #2)","Sarah Mlynowski",3.97,4863,"eng",288,2006,"Delacorte Press","Juvenile Fiction",221,"Young Adult and Children Fiction"
"Essential Dialogues of Plato","Plato/Benjamin Jowett/Pedro De Blas",4.05,4853,"eng",624,2005,"Barnes  Noble Classics","Philosophy",14,"Social Sciences & Philosophy"
"Atonement","Ian McEwan",3.9,4844,"eng",372,2002,"Vintage","Atonement",506,"Religious & Spiritual"
"Santa Cruise: A Holiday Mystery at Sea","Mary Higgins Clark/Carol Higgins Clark",3.41,4844,"eng",261,2006,"Scribner","Fiction",433,"Fiction"
"Betsy Was a Junior (Betsy-Tacy  #7)","Maud Hart Lovelace/Vera Neville",4.17,4839,"en-US",320,1995,"HarperTrophy","Juvenile Fiction",126,"Young Adult and Children Fiction"
"The Finer Points of Sausage Dogs (Portuguese Irregular Verbs  #2)","Alexander McCall Smith",3.69,4833,"eng",128,2004,"Anchor","Fiction",479,"Fiction"
"The Vampire Companion","Katherine Ramsland/Anne Rice",3.94,4829,"en-US",608,1995,"Ballantine Books","Fiction",25,"Fiction"
"Five Patients","Michael Crichton",3.48,4828,"eng",204,1989,"Ballantine Books","Social Science",97,"Social Sciences & Philosophy"
"Mary  Queen of Scots: Queen Without a Country","Kathryn Lasky",3.83,4825,"eng",202,2002,"Scholastic","Juvenile Fiction",148,"Young Adult and Children Fiction"
"Catfish and Mandala: A Two-Wheeled Voyage Through the Landscape and Memory of Vietnam","Andrew X. Pham",3.96,4820,"en-US",344,2000,"Picador USA","Biography & Autobiography",524,"Biography & Autobiography"
"Falling for You","Jill Mansell",3.8,4816,"eng",448,2004,"Headline Review","Fiction",143,"Fiction"
"To the Last Man: A Novel of the First World War","Jeff Shaara",4.22,4809,"eng",636,2005,"Ballantine Books","Fiction",315,"Fiction"
"The Spectator Bird","Wallace Stegner",3.99,4808,"eng",214,1990,"Penguin","Fiction",550,"Fiction"
"Old Town in the Green Groves: Laura Ingalls Wilder's Lost Little House Years","Cynthia Rylant/Jim LaMarche",4.05,4799,"eng",176,2004,"Harper Trophy","Juvenile Fiction",88,"Young Adult and Children Fiction"
"The Feeling Good Handbook","David D. Burns",4,4797,"eng",729,1999,"Penguin","Psychology",124,"Social Sciences & Philosophy"
"Amber Brown Is Not a Crayon","Paula Danziger/Tony Ross",3.84,4787,"eng",96,2006,"Puffin Books","Juvenile Fiction",189,"Young Adult and Children Fiction"
"The Mind’s I: Fantasies and Reflections on Self and Soul","Douglas R. Hofstadter/Daniel C. Dennett",4.14,4786,"eng",512,1985,"Bantam Books","Philosophy",92,"Social Sciences & Philosophy"
"The Basic Political Writings","Jean-Jacques Rousseau/Donald A. Cress/Peter Gray",3.87,4786,"eng",227,1987,"Hackett Publishing Company  Inc.","Philosophy",24,"Social Sciences & Philosophy"
"The Flame Trees of Thika: Memories of an African Childhood","Elspeth Huxley",4.12,4773,"en-GB",281,2000,"Penguin Classics","Biography & Autobiography",217,"Biography & Autobiography"
"Bowling Alone: The Collapse and Revival of American Community","Robert D. Putnam",3.8,4762,"eng",544,2001,"Simon  Schuster","History",512,"History & Historical Fiction"
"The Discomfort Zone: A Personal History","Jonathan Franzen",3.4,4760,"eng",195,2006,"Farrar Straus Giroux","Biography & Autobiography",532,"Biography & Autobiography"
"Slightly Settled (Slightly  #2)","Wendy Markham",3.68,4756,"en-US",312,2004,"Red Dress Ink","Fiction",84,"Fiction"
"The Subtle Knife (His Dark Materials  #2)","Philip Pullman",4.13,4750,"en-US",288,2003,"Laurel Leaf Library","Juvenile Fiction",337,"Young Adult and Children Fiction"
"Word Freak: Heartbreak  Triumph  Genius  and Obsession in the World of Competitive Scrabble Players","Stefan Fatsis",3.82,4748,"eng",372,2002,"Penguin Books","Biography & Autobiography",597,"Biography & Autobiography"
"Betsy and the Great World (Betsy-Tacy  #9)","Maud Hart Lovelace/Vera Neville",4.14,4747,"eng",321,1996,"HarperTrophy","Juvenile Fiction",148,"Young Adult and Children Fiction"
"And I Don't Want to Live This Life: A Mother's Story of Her Daughter's Murder","Deborah Spungen",4.1,4746,"eng",408,1996,"Ballantine Books","Biography & Autobiography",298,"Biography & Autobiography"
"Interface","Neal Stephenson/George F. Jewsbury/Stephen  Bury",3.68,4731,"eng",640,2005,"Spectra","Fiction",270,"Fiction"
"Caribbean","James A. Michener",3.93,4718,"eng",672,2005,"Dial Press","Fiction",232,"Fiction"
"Notes from Underground & The Double","Fyodor Dostoyevsky/Jessie Coulson",4.2,4706,"eng",287,1972,"Penguin Books","Fiction",151,"Fiction"
"The Nonexistent Knight & The Cloven Viscount","Italo Calvino",4.03,4701,"en-US",272,1977,"Mariner Books","Fiction",181,"Fiction"
"No Dominion (Joe Pitt  #2)","Charlie Huston",3.99,4698,"eng",251,2006,"Del Rey","Fiction",202,"Fiction"
"The Family Trade (The Merchant Princes  #1)","Charles Stross",3.52,4691,"eng",308,2005,"Tor Fantasy","Fiction",355,"Fiction"
"The Letters of J.R.R. Tolkien","J.R.R. Tolkien/Humphrey Carpenter/Christopher Tolkien",4.15,4689,"eng",502,2000,"Mariner Books","Biography & Autobiography",171,"Biography & Autobiography"
"The Languages of Tolkien's Middle-Earth","Ruth S. Noel/J.R.R. Tolkien",3.98,4685,"eng",207,1980,"Houghton Mifflin Company","Fiction",74,"Fiction"
"The Cheese Monkeys","Chip Kidd",3.75,4672,"en-US",288,2002,"Harper Perennial","Fiction",512,"Fiction"
"Tales of Power","Carlos Castañeda",4.13,4657,"en-US",304,1991,"Washington Square Press","Fiction",89,"Fiction"
"The Curse of the Mistwraith (Wars of Light and Shadow  #1)","Janny Wurts",3.76,4655,"eng",830,2009,"HarperCollins","Fiction",202,"Fiction"
"Edie","Jean Stein/George Plimpton",4.14,4639,"eng",564,1994,"Grove Press","Biography & Autobiography",227,"Biography & Autobiography"
"Master of the Night (Mageverse #1)","Angela Knight",3.88,4637,"eng",296,2004,"Berkley Sensation","Fiction",125,"Fiction"
"Shout! The Beatles in Their Generation","Philip Norman",4.03,4624,"eng",546,2005,"Fireside","Biography & Autobiography",137,"Biography & Autobiography"
"The Gift of the Magi and Other Short Stories","O. Henry",4.15,4616,"eng",96,1992,"Dover Publications","Fiction",133,"Fiction"
"Airs Above the Ground","Mary  Stewart",4.05,4615,"eng",384,2004,"HarperTorch","Fiction",255,"Fiction"
"Plan of Attack","Bob Woodward/Alice Mayhew",3.68,4603,"eng",480,2004,"Simon & Schuster","Political Science",121,"Education, Business & Economics"
"Blood Sport","Dick Francis",3.89,4600,"eng",288,2004,"G.P. Putnam's Sons","Fiction",113,"Fiction"
"Chasing The Falconers (On The Run  #1)","Gordon Korman",4.05,4598,"eng",154,2005,"Scholastic  Inc.","Juvenile Fiction",371,"Young Adult and Children Fiction"
"The Ice Storm","Rick Moody",3.66,4592,"eng",288,2002,"Back Bay Books","Fiction",334,"Fiction"
"The Border Trilogy: All the Pretty Horses  The Crossing  Cities of the Plain","Cormac McCarthy",4.44,4589,"eng",1040,1999,"Everyman's Library","Fiction",252,"Fiction"
"Betsy and Joe (Betsy-Tacy  #8)","Maud Hart Lovelace/Vera Neville",4.31,4586,"eng",336,1995,"HarperTrophy","Juvenile Fiction",119,"Young Adult and Children Fiction"
"Horse Heaven","Jane Smiley",3.88,4583,"eng",640,2003,"Ballantine Books","Fiction",328,"Fiction"
"The Trojan Women","Euripides/Gilbert Murray",3.89,4577,"eng",80,2006,"Digireads.com","Drama",126,"Arts & Culture"
"The Family that Couldn't Sleep","D.T. Max",3.91,4568,"eng",299,2006,"Random House (NY)","Health & Fitness",350,"Health, Personal Development & Relationships"
"Bargaining for Advantage: Negotiation Strategies for Reasonable People","G. Richard Shell",3.95,4560,"en-US",320,2006,"Penguin Books","Business & Economics",85,"Education, Business & Economics"
"McElligot's Pool","Dr. Seuss",4.06,4560,"eng",64,1947,"Random House Books for Young Readers","Juvenile Fiction",253,"Young Adult and Children Fiction"
"Judy Moody  M.D.: The Doctor is In! (Judy Moody #5)","Megan McDonald/Peter H. Reynolds",4.08,4554,"eng",176,2006,"Candlewick Press","JUVENILE FICTION",151,"Young Adult and Children Fiction"
"Imperial Life in the Emerald City: Inside Iraq's Green Zone","Rajiv Chandrasekaran",4.02,4545,"eng",320,2006,"Knopf","History",477,"History & Historical Fiction"
"The Grass Harp  Including A Tree of Night and Other Stories","Truman Capote",4.01,4533,"eng",272,1993,"Vintage","Fiction",188,"Fiction"
"Why Is Sex Fun? The Evolution of Human Sexuality (Science Masters)","Jared Diamond",3.71,4532,"eng",176,1998,"Basic Books","Health & Fitness",278,"Health, Personal Development & Relationships"
"The Lord of the Rings: The Two Towers: Visual Companion","Jude Fisher/Viggo Mortensen",4.51,4524,"eng",72,2002,"Houghton Mifflin Harcourt","Fiction",23,"Fiction"
"Conspiracy of Fools","Kurt Eichenwald",4.23,4511,"eng",784,2005,"Broadway Books","Business & Economics",309,"Education, Business & Economics"
"The White Masai","Corinne Hofmann/Peter Millar",3.45,4504,"eng",320,2006,"Amistad","Biography & Autobiography",491,"Biography & Autobiography"
"Sideways","Rex Pickett",3.69,4494,"eng",368,2004,"St. Martin's Griffin","Fiction",522,"Fiction"
"As She Climbed Across the Table","Jonathan Lethem",3.67,4488,"eng",212,1998,"Vintage","Fiction",380,"Fiction"
"Euripides I: Alcestis / The Medea / The Heracleidae / Hippolytus","Euripides/Richmond Lattimore/David Grene/Rex Warner/Ralph Gladstone",4.03,4483,"eng",221,1955,"University of Chicago Press","Greek drama (Tragedy)",56,"Other"
"Plot & Structure: Techniques and Exercises for Crafting a Plot That Grips Readers from Start to Finish","James Scott Bell",4.1,4480,"eng",234,2004,"Writer's Digest Books","Language Arts & Disciplines",439,"Education, Business & Economics"
"Goddess of Love (Goddess Summoning  #5)","P.C. Cast",4.06,4475,"eng",292,2007,"Berkley Books","Fiction",196,"Fiction"
"The White Man's Burden: Why the West's Efforts to Aid the Rest Have Done So Much Ill and So Little Good","William Easterly",3.83,4473,"eng",436,2007,"Penguin Books","Business & Economics",232,"Education, Business & Economics"
"Anatomy of a Boyfriend (Anatomy  #1)","Daria Snadowsky",3.41,4470,"eng",259,2007,"Delacorte Press","Juvenile Fiction",485,"Young Adult and Children Fiction"
"Virgin Earth  (Tradescant  #2)","Philippa Gregory",3.62,4469,"en-US",661,2006,"Washington Square Press","Fiction",272,"Fiction"
"Theater Shoes (Shoes  #4)","Noel Streatfeild/Diane Goode",4.02,4461,"eng",272,1994,"Yearling","Juvenile Fiction",158,"Young Adult and Children Fiction"
"False Colours","Georgette Heyer",3.86,4457,"eng",303,2005,"Arrow","Brothers",330,"Biography & Autobiography"
"When I Don't Desire God: How to Fight for Joy","John Piper",4.19,4446,"eng",268,2004,"Crossway Books","Religion",218,"Religious & Spiritual"
"Bored of the Rings: A Parody of J.R.R. Tolkien's Lord of the Rings","The Harvard Lampoon/Henry N. Beard/Douglas C. Kenney",3.13,4438,"eng",149,1993,"Roc Trade","Fiction",301,"Fiction"
"Past Mortem","Ben Elton",3.75,4422,"eng",460,2005,"Black Swan","Fiction",211,"Fiction"
"The Blackwater Lightship","Colm Tóibín",3.87,4421,"eng",288,2005,"Scribner","Fiction",367,"Fiction"
"Carnet de Voyage","Craig Thompson",3.76,4415,"en-US",224,2004,"Top Shelf Productions","Comics & Graphic Novels",400,"Other"
"The Arctic Event (Covert-One  #7)","James H. Cobb/Robert Ludlum",4.01,4414,"eng",390,2007,"Warner Books","Fiction",127,"Fiction"
"The Adversary (Saga of Pliocene Exile  #4)","Julian May",4.22,4404,"eng",472,1987,"Del Rey Books","Science",54,"Technology, Science & Animals"
"The Corner: A Year in the Life of an Inner-City Neighborhood","David Simon/Edward Burns",4.43,4404,"eng",576,1998,"Broadway Books","Social Science",434,"Social Sciences & Philosophy"
"You: On a Diet: The Owner's Manual for Waist Management","Michael F. Roizen/Mehmet C. Oz",3.66,4403,"en-US",370,2006,"Free Press","Reducing diets",405,"Health, Personal Development & Relationships"
"Sophie's World","Jostein Gaarder/Paulette Møller",3.92,4399,"en-US",518,2007,"Farrar  Straus and Giroux","Fiction",515,"Fiction"
"If I Have a Wicked Stepmother  Where's My Prince?","Melissa Kantor",3.66,4393,"en-US",283,2005,"Disney-Hyperion","Juvenile Fiction",432,"Young Adult and Children Fiction"
"Snow","Roy McKie/P.D. Eastman",4.15,4383,"eng",72,1962,"Random House","Juvenile Nonfiction",88,"Young Adult and Children Fiction"
"Here  There and Everywhere: My Life Recording the Music of the Beatles","Geoff Emerick/Howard Massey/Elvis Costello",4.25,4381,"eng",400,2007,"Avery Publishing Group","Biography & Autobiography",255,"Biography & Autobiography"
"Time of Wonder","Robert McCloskey",4.08,4380,"en-US",64,1985,"Puffin Books","Juvenile Fiction",308,"Young Adult and Children Fiction"
"Lovingkindness: The Revolutionary Art of Happiness","Sharon Salzberg/Jon Kabat-Zinn",4.24,4373,"eng",256,2004,"Shambhala","Self-Help",144,"Health, Personal Development & Relationships"
"Soul Mates: Honouring the Mysteries of Love and Relationship","Thomas  Moore",3.99,4372,"eng",288,2013,"Harper Perennial","Psychology",81,"Social Sciences & Philosophy"
"Jack of Fables  Vol. 1: The (Nearly) Great Escape","Bill Willingham/Matthew Sturges/Tony Akins/Andrew Pepoy",3.58,4372,"eng",128,2007,"Vertigo","Comics & Graphic Novels",271,"Other"
"Spells & Sleeping Bags (Magic in Manhattan  #3)","Sarah Mlynowski",4.05,4370,"eng",324,2007,"Delacorte Books for Young Readers","Juvenile Fiction",221,"Young Adult and Children Fiction"
"The Last Jew","Noah Gordon/Mirjana Cvekić/Ljiljana Cvekić",4.1,4360,"eng",352,2000,"St. Martin's Griffin","Fiction",189,"Fiction"
"The Read-Aloud Handbook","Jim Trelease",4.41,4357,"eng",432,2006,"Penguin Books","Language Arts & Disciplines",707,"Education, Business & Economics"
"The Cossacks","Leo Tolstoy/Peter Constantine/Cynthia Ozick",3.79,4356,"eng",161,2006,"Modern Library","Fiction",226,"Fiction"
"Ghost Hunter (Ghost Hunters  #3)","Jayne Castle/Jayne Ann Krentz",4.14,4349,"eng",327,2006,"Jove Books","Fiction",170,"Fiction"
"Children of the Night (Diana Tregarde  #2)","Mercedes Lackey",3.94,4349,"en-US",320,2005,"St. Martins Press-3PL","Fiction",103,"Fiction"
"Young Men and Fire","Norman Maclean",4.08,4346,"eng",301,1993,"University Of Chicago Press","Biography & Autobiography",386,"Biography & Autobiography"
"Happy Birthday to You!","Dr. Seuss",4.13,4344,"eng",64,1959,"Random House Books for Young Readers","Juvenile Fiction",262,"Young Adult and Children Fiction"
"The Good Fairies of New York","Martin Millar/Neil Gaiman",3.51,4343,"eng",242,2006,"Soft Skull Press","Fiction",563,"Fiction"
"The Land of Laughs","Jonathan Carroll",3.9,4337,"eng",253,2001,"Orb Books","Fiction",352,"Fiction"
"Weight: The Myth of Atlas and Heracles","Jeanette Winterson",3.77,4326,"eng",151,2005,"Canongate U.S.","Fiction",392,"Fiction"
"Life of Pi","Yann Martel",3.91,4318,"en-US",401,2004,"Mariner Books / Harvest Books","",668,"Other"
"Stern Men","Elizabeth Gilbert",3.41,4308,"eng",304,2001,"Mariner Books","Fiction",542,"Fiction"
"Prometheus Bound and Other Plays","Aeschylus/Philip Vellacott",4.1,4303,"eng",160,1961,"Penguin Books","Drama",62,"Arts & Culture"
"Agatha Christie: An Autobiography","Agatha Christie/Robert Welch Herrick",4.27,4296,"eng",560,2001,"HarperCollins","Authors, English",310,"Biography & Autobiography"
"Jamie's Dinners: The Essential Family Cookbook","Jamie Oliver/Marion Deuchars/David Loftus/Chris Terry",4.07,4296,"eng",336,2004,"Hachette Books","Cooking",51,"Health, Personal Development & Relationships"
