"Title","Authors","Average_Rating","Ratings_Count","Language_Code","Num_Pages","Publication_Date","Publisher","Categories","Text_Reviews_Count","Theme"
"South Park and Philosophy: You Know  I Learned Something Today","Robert Arp",3.43,1135,"eng",273,2006,"Blackwell Publishers","Philosophy",37,"Social Sciences & Philosophy"
"The Demon Princes  Volume One: The Star King  The Killing Machine  The Palace of Love","Jack Vance",4.25,1134,"eng",446,1997,"Orb Books","Fiction",44,"Fiction"
"The Chronicles of Narnia (The Chronicles of Narnia  #1-7)","C.S. Lewis/Pauline Baynes",4.26,1131,"eng",766,2005,"HarperEntertainment","Fiction",53,"Fiction"
"The Odyssey","Homer/Richmond Lattimore",3.76,1131,"eng",374,1999,"Harper Perennial","Fiction",78,"Fiction"
"Tales Before Tolkien: The Roots of Modern Fantasy","Douglas A. Anderson/Frank R. Stockton/Ludwig Tieck/Richard Garnett/H. Rider Haggard/Andrew Lang/William Hope Hodgson/E.A. Wyke-Smith/David  Lindsay/Clemence Housman/George MacDonald/Arthur Machen/A. Merritt/L. Frank Baum/Kenneth Morris/William Morris/James Branch Cabell/Lord Dunsany/Francis Stevens/E.H. Knatchbull-Hugessen/E. Nesbit",3.93,1130,"eng",528,2005,"Del Rey","Fiction",42,"Fiction"
"Achilles in Vietnam: Combat Trauma and the Undoing of Character","Jonathan Shay",4.25,1130,"en-US",272,1995,"Scribner","Psychology",110,"Social Sciences & Philosophy"
"Carpenter's Gothic","William Gaddis",3.77,1128,"eng",262,2010,"Atlantic Books (UK)","Married people",79,"Health, Personal Development & Relationships"
"Betrayal of Trust: The Collapse of Global Public Health","Laurie Garrett/Steven M. Wolinsky",4.12,1126,"eng",768,2001,"Hachette Books","Medical",50,"Technology, Science & Animals"
"The Spider's House","Paul Bowles/Francine Prose",4.02,1123,"eng",432,2006,"Ecco","Fiction",99,"Fiction"
"The Glass House (Captain Lacey  #3)","Ashley Gardner",4.04,1123,"eng",256,2004,"Berkley","Fiction",62,"Fiction"
"The Orion Mystery: Unlocking the Secrets of the Pyramids","Robert Bauval/Adrian Geoffrey Gilbert",3.94,1123,"eng",352,1995,"Three Rivers Press","History",36,"History & Historical Fiction"
"Complete Short Stories","Graham Greene/Pico Iyer",4.17,1122,"eng",594,2005,"Penguin Classics","Fiction",69,"Fiction"
"On Writing: A Memoir","Stephen King",4.33,1118,"eng",384,2001,"New English Library","Authors, American",142,"Biography & Autobiography"
"Assumed Identity","David Morrell",3.78,1118,"eng",512,1994,"Vision","Fiction",46,"Fiction"
"Aliens: Nightmare Asylum","Steve Perry",3.67,1118,"en-US",277,1993,"Spectra Books","Fiction",54,"Fiction"
"Big Money","P.G. Wodehouse",3.93,1117,"eng",288,1991,"Penguin Books","Fiction",78,"Fiction"
"A Day in the Life: The Music and Artistry of the Beatles","Mark Hertsgaard",4.16,1116,"eng",448,1996,"Delta","Music",46,"Arts & Culture"
"The Earth","Émile Zola/Douglas Parmée",4.08,1113,"eng",506,1980,"Penguin Classics","Fiction",70,"Fiction"
"My Movie Business: A Memoir","John Irving",3.34,1113,"eng",222,2000,"Ballantine Books","Biography & Autobiography",60,"Biography & Autobiography"
"Poppy's Return","Avi/Brian Floca",3.99,1110,"eng",256,2006,"HarperCollins","Juvenile Fiction",71,"Young Adult and Children Fiction"
"Norse Mythology: A Guide to the Gods  Heroes  Rituals  and Beliefs","John Lindow",4.11,1107,"eng",365,2002,"Oxford University Press  USA","Fiction",33,"Fiction"
"Charon's Landing (Philip Mercer  #2)","Jack Du Brul",4.08,1107,"en-US",496,2006,"NAL","Fiction",38,"Fiction"
"The Collected Dorothy Parker","Dorothy Parker/Brendan Gill",4.29,1106,"eng",604,2001,"Penguin Classics","Classical fiction",50,"Fiction"
"Bridget Jones's Guide to Life","Helen Fielding",3.49,1104,"en-US",64,2001,"Penguin Books","Fiction",34,"Fiction"
"Letting Go","Philip Roth",3.7,1103,"eng",630,1997,"Vintage","Fiction",88,"Fiction"
"Eight Mindful Steps to Happiness: Walking the Buddha's Path","Henepola Gunaratana",4.3,1103,"eng",288,2001,"Wisdom Publications","Body, Mind & Spirit",50,"Health, Personal Development & Relationships"
"Marie Antoinette: The Journey","Antonia Fraser",3.93,1102,"eng",512,2002,"Anchor","Biography & Autobiography",154,"Biography & Autobiography"
"Ranma 1/2  Vol. 12 (Ranma ½ (US 2nd)  #12)","Rumiko Takahashi",4.11,1102,"eng",200,2004,"VIZ Media LLC","Comics & Graphic Novels",19,"Other"
"Reckless Love (MacKenzie-Blackthorn #1)","Elizabeth Lowell",3.8,1101,"eng",384,2006,"Harlequin","Fiction",45,"Fiction"
"The Bachman Books: Four Early Novels by Stephen King","Stephen King/Richard Bachman",4.11,1098,"eng",692,1985,"NAL Books","Fiction",84,"Fiction"
"The Pusher (87th Precinct  #3)","Ed McBain",3.9,1098,"eng",192,2003,"Orion Books","87th Precinct (Imaginary place)",75,"Fantasy & Science Fiction"
"A New Leash on Death (A Dog Lover's Mystery  #1)","Susan Conant",3.79,1097,"eng",180,1994,"Berkley Prime Crime","Fiction",71,"Fiction"
"The Thrill of Victory","Erin St. Claire/Sandra Brown",3.62,1097,"eng",240,2003,"MIRA","Fiction",56,"Fiction"
"Star Wars: The Complete Visual Dictionary","James Luceno/David West Reynolds/Ryder Windham",4.33,1094,"eng",272,2006,"DK Children","Juvenile Nonfiction",40,"Young Adult and Children Fiction"
"Creative Correction: Extraordinary Ideas For Everyday Discipline","Lisa Whelchel/Stormie Omartian",3.93,1094,"en-US",367,2010,"Thomas Nelson","Family & Relationships",87,"Health, Personal Development & Relationships"
"X/1999  Volume 02: Overture","CLAMP/Fred Burke",4.03,1092,"en-US",192,2003,"VIZ Media LLC","Comics & Graphic Novels",10,"Other"
"Introduction to the Philosophy of History with Selections from The Philosophy of Right","Georg Wilhelm Friedrich Hegel/Leo Rauch",3.76,1088,"eng",106,1988,"Hackett Publishing Company  Inc.","Philosophy",52,"Social Sciences & Philosophy"
"Rendezvous in Black","Cornell Woolrich/Richard Dooling",3.96,1087,"eng",211,2004,"Modern Library","Fiction",99,"Fiction"
"Crash Proof: How to Profit from the Coming Economic Collapse","Peter D. Schiff/John Downes",3.78,1086,"eng",272,2007,"John Wiley & Sons","Business & Economics",89,"Education, Business & Economics"
"Kiffe Kiffe Tomorrow","Faïza Guène/Sarah    Adams",3.4,1084,"eng",179,2006,"Mariner Books","Fiction",131,"Fiction"
"Vampire Hunter D Volume 05: The Stuff of Dreams","Hideyuki Kikuchi/Yoshitaka Amano",3.99,1083,"en-US",208,2006,"Digital Manga Publishing / Dark Horse","Comics & Graphic Novels",26,"Other"
"On Being Ill","Virginia Woolf/Hermione Lee",4.02,1083,"eng",63,2002,"Paris Press","Literary Collections",96,"Fiction"
"The Wheel of Life: A Memoir of Living and Dying","Elisabeth Kübler-Ross",4.16,1080,"eng",288,1998,"Scribner","Biography & Autobiography",112,"Biography & Autobiography"
"A Pinch of Snuff (Dalziel & Pascoe  #5)","Reginald Hill",3.84,1077,"eng",336,1990,"Dell","Fiction",47,"Fiction"
"Ancient Greece and the Olympics (Magic Tree House Research Guide  #10)","Mary Pope Osborne/Natalie Pope Boyce/Salvatore Murdocca",4.05,1073,"eng",119,2004,"Random House Books for Young Readers","Juvenile Nonfiction",30,"Young Adult and Children Fiction"
"Inside the Mind of Gideon Rayburn (Midvale Academy  #1)","Sarah Miller",3.39,1072,"eng",289,2006,"St. Martin's Griffin","Juvenile Fiction",90,"Young Adult and Children Fiction"
"The Pen Is Mightier Than The Sword (The Amazing Days of Abby Hayes  #6)","Anne Mazer/Monica Gesue",3.96,1072,"eng",128,2001,"Scholastic Paperbacks","Juvenile Fiction",20,"Young Adult and Children Fiction"
"The Ruby Ring","Diane Haeger",3.7,1070,"eng",371,2005,"Broadway Books","Fiction",70,"Fiction"
"In the Company of Cheerful Ladies (No. 1 Ladies' Detective Agency  #6)","Alexander McCall Smith",4.08,1070,"eng",256,2006,"Anchor","Fiction",73,"Fiction"
"I Can Fly","Ruth Krauss/Mary Blair",4.24,1069,"eng",24,2003,"Golden Books","Animals",70,"Technology, Science & Animals"
"Hardcase (Joe Kurtz  #1)","Dan Simmons",3.68,1067,"en-US",291,2002,"Minotaur Books","Fiction",61,"Fiction"
"Gone Bamboo","Anthony Bourdain",3.48,1066,"eng",286,2002,"Canongate Books","Assassins",74,"Fantasy & Science Fiction"
"When Rain Clouds Gather","Bessie Head",3.84,1063,"eng",185,1996,"Heinemann Educational Books","Fiction",86,"Fiction"
"Soldier of Sidon (Latro #3)","Gene Wolfe",4.01,1063,"eng",320,2006,"Tor Books","Fiction",60,"Fiction"
"Things: A Story of the Sixties; A Man Asleep","Georges Perec/David Bellos/Andrew Leak",3.98,1062,"eng",221,2010,"David R. Godine Publisher","Comics & Graphic Novels",63,"Other"
"Vampire Hunter D Volume 07: Mysterious Journey to the North Sea - Part One","Hideyuki Kikuchi/Yoshitaka Amano",4.27,1062,"en-US",209,2007,"Digital Manga Publishing / Dark Horse","Comics & Graphic Novels",19,"Other"
"City of Night (Dean Koontz's Frankenstein  #2)","Dean Koontz/Ed Gorman",3.98,1060,"en-US",455,2005,"Bantam Books","Horror tales",116,"Fantasy & Science Fiction"
"Deep Fire Rising (Philip Mercer  #6)","Jack Du Brul",4.19,1059,"eng",483,2003,"Berkley Books","Fiction",27,"Fiction"
"Ronald Reagan: How an Ordinary Man Became an Extraordinary Leader","Dinesh D'Souza",4.13,1059,"eng",304,1999,"Free Press","Biography & Autobiography",35,"Biography & Autobiography"
"Cuba 15","Nancy Osa",3.45,1054,"eng",304,2005,"Ember","Juvenile Fiction",145,"Young Adult and Children Fiction"
"The New Jessica (Sweet Valley High  #32)","Francine Pascal/Kate William",3.44,1054,"eng",136,1986,"Bantam Books","Juvenile Fiction",25,"Young Adult and Children Fiction"
"Journal of a Novel: The East of Eden Letters","John Steinbeck",4.09,1053,"eng",182,1990,"Penguin Books","Literary Criticism",126,"Fiction"
"The Gonzo Way: A Celebration of Dr. Hunter S. Thompson","Anita Thompson",3.96,1052,"en-US",112,2007,"Fulcrum Publishing","Biography & Autobiography",36,"Biography & Autobiography"
"First Comes Love (Hot Water  California #1)","Christie Ridgway",3.81,1051,"en-US",384,2002,"Avon Books","Fiction",47,"Fiction"
"The River's Gift","Mercedes Lackey",3.9,1050,"eng",128,1999,"Roc Hardcover","Fiction",59,"Fiction"
"The Marvel Encyclopedia","Tom DeFalco/Peter Sanderson/Michael Teitelbaum/Daniel  Wallace/Tom Brevoort/Andrew Darling",4.37,1049,"eng",352,2006,"DK","Comics & Graphic Novels",43,"Other"
"Mystical Paths (Starbridge  #5)","Susan Howatch",4.23,1045,"eng",576,1996,"HarperCollins Publishers","English fiction",38,"Fiction"
"Running from the Deity (Pip & Flinx #11)","Alan Dean Foster",3.81,1045,"eng",280,2006,"Del Rey Books","Fiction",26,"Fiction"
"My Name is Aram","William Saroyan/Don Freeman",4.15,1045,"en-US",151,1991,"Laurel Press","Fiction",66,"Fiction"
"Chilly Scenes of Winter","Ann Beattie",3.91,1045,"en-GB",288,1991,"Vintage","Fiction",100,"Fiction"
"The Wave in the Mind: Talks and Essays on the Writer  the Reader and the Imagination","Ursula K. Le Guin",4.3,1044,"eng",314,2004,"Shambhala","Literary Collections",164,"Fiction"
"Isak Dinesen: The Life of a Storyteller","Judith Thurman",4.06,1041,"en-US",512,1995,"Picador","Biography & Autobiography",53,"Biography & Autobiography"
"Seven Nights","Jorge Luis Borges/Eliot Weinberger",4.33,1037,"eng",121,1985,"New Directions Publishing Corporation","Literary Collections",60,"Fiction"
"The Stone Fey","Robin McKinley/John Clapp",3.36,1036,"eng",64,1998,"HMH Books for Young Readers","Juvenile Fiction",78,"Young Adult and Children Fiction"
"A Theory of Semiotics","Umberto Eco",4.01,1035,"eng",368,1978,"Indiana University Press","Literary Criticism",34,"Fiction"
"Wrinkles in Time","George Smoot/Keay Davidson",4.01,1035,"eng",360,1994,"Harper Perennial","Science",23,"Technology, Science & Animals"
"Shadow: Five Presidents and the Legacy of Watergate","Bob Woodward",3.72,1035,"eng",608,2000,"Simon & Schuster","History",42,"History & Historical Fiction"
"The Hour Before Dark","Douglas Clegg",3.76,1034,"eng",370,2003,"Leisure Books","Fiction",78,"Fiction"
"Within a Budding Grove (In Search of Lost Time  #2)","Marcel Proust/C.K. Scott Moncrieff/Terence Kilmartin/D.J. Enright",4.4,1032,"eng",749,1998,"Modern Library","France",162,"Travel & Places"
"Redburn / White-Jacket / Moby-Dick","Herman Melville/G. Thomas Tanselle",4.2,1031,"eng",1436,1983,"Library of America","",72,"Other"
"Taxi Driver","Paul Schrader",4.12,1030,"eng",116,2000,"Faber  Faber","Performing Arts",24,"Arts & Culture"
"Z for Zachariah","Robert C. O'Brien",3.66,1030,"eng",250,2007,"Simon Pulse","Juvenile Fiction",231,"Young Adult and Children Fiction"
"Stiff: The Curious Lives of Human Cadavers","Mary Roach",4.06,1029,"eng",304,2004,"Penguin","Dead",188,"Social Sciences & Philosophy"
"Double Dealer (CSI: Crime Scene Investigation  #1)","Max Allan Collins/Mike Flaherty",3.67,1029,"en-US",320,2003,"Pocket Books","Fiction",53,"Fiction"
"The Parallax View","Slavoj Žižek",4,1027,"eng",433,2006,"MIT Press (MA)","Philosophy",51,"Social Sciences & Philosophy"
"Fads and Fallacies in the Name of Science","Martin Gardner",4.06,1022,"eng",384,1957,"Dover Publications (NY)","Science",46,"Technology, Science & Animals"
"Late Victorian Holocausts: El Niño Famines and the Making of the Third World","Mike  Davis",4.11,1021,"eng",474,2002,"Verso","History",101,"History & Historical Fiction"
"Julie  or the New Heloise","Jean-Jacques Rousseau/Philip Stewart/Jean Vache",3.46,1019,"en-US",728,1997,"Dartmouth College Press","Literary Criticism",27,"Fiction"
"Selected Short Stories","William Faulkner",4.09,1017,"eng",320,1993,"Modern Library","Fiction",64,"Fiction"
"The Waste Lands (The Dark Tower #3)","Stephen King/Ned Dameron",4.24,1013,"eng",590,1993,"Signet Book","Fiction",96,"Fiction"
"You are Being Lied To: The Disinformation Guide to Media Distortion  Historical Whitewashes  and Cultural Myths","Russ Kick",3.87,1010,"eng",399,2001,"Disinformation Company","Language Arts & Disciplines",34,"Education, Business & Economics"
"The Female of the Species: Tales of Mystery and Suspense","Joyce Carol Oates",3.62,1009,"eng",275,2007,"Mariner Books","Fiction",109,"Fiction"
"The Blue Flowers","Raymond Queneau",4.05,1008,"eng",232,1985,"New Directions","Poetry",37,"International Literature & Poetry"
"The Cursed One (Wild Wulfs of London  #3)","Ronda Thompson",4.02,1006,"eng",305,2006,"St. Martin's Paperbacks","Fiction",46,"Fiction"
"Three Complete Novels: The Andromeda Strain / The Terminal Man / The Great Train Robbery","Michael Crichton",4.06,1004,"eng",688,1993,"Wings","Fiction",31,"Fiction"
"A Midsummer Night's Dream","William Shakespeare/Stephen Orgel/A.R. Braunmuller/Russ McDonald",3.94,1002,"eng",144,2000,"Penguin Classics","Drama",57,"Arts & Culture"
"The System of Objects","Jean Baudrillard/James Benedict",4.01,1002,"eng",224,2006,"Verso","Philosophy",27,"Social Sciences & Philosophy"
"Layer Cake","J.J. Connolly",3.98,1000,"eng",344,2004,"Grove Press  Black Cat","Fiction",68,"Fiction"
"Strangers In Paradise  Pocket Book 5","Terry Moore",4.38,999,"eng",392,2005,"Abstract Studio","Comics & Graphic Novels",24,"Other"
"The Print (Ansel Adams Photography  #3)","Ansel Adams/Robert Hardy Baker",4.37,997,"en-US",203,1995,"Little  Brown and Company","Photography",14,"Arts & Culture"
"Moon in a Dewdrop: Writings of Zen Master Dogen","Dōgen/Kazuaki Tanahashi/Robert Aitken/Reb Anderson/Edward G. Brown/Norman Fischer/Arnold Kotler/Daniel Leighton/Lew Richmond/Katherine Thanas/Brian Unger/Mel Weitsman/Dan Welch/Philip Whalen/David    Schneider",4.28,997,"eng",356,1995,"North Point Press","Philosophy",27,"Social Sciences & Philosophy"
"The Aeneid","Virgil/David   West",3.84,996,"eng",290,2003,"Penguin Books Ltd","Literary Criticism",96,"Fiction"
"Europe and the People Without History","Eric R. Wolf",4.12,995,"eng",534,1982,"University of California Press","Social Science",32,"Social Sciences & Philosophy"
"Sagwa  the Chinese Siamese Cat","Amy Tan/Gretchen Schields",4.03,995,"eng",40,2001,"Aladdin Paperbacks","Juvenile Fiction",57,"Young Adult and Children Fiction"
"Art and Beauty in the Middle Ages","Umberto Eco/Hugh Bredin",3.99,994,"en-US",144,2002,"Yale University Press","Art",35,"Arts & Culture"
"The Collected Autobiographies of Maya Angelou","Maya Angelou",4.63,991,"eng",1184,2004,"Modern Library","Biography & Autobiography",55,"Biography & Autobiography"
"Ray Bradbury's Fahrenheit 451","Harold Bloom",4.18,991,"eng",147,2001,"Chelsea House Publications","Juvenile Nonfiction",52,"Young Adult and Children Fiction"
"The Dark Side Of Genius: The Life Of Alfred Hitchcock","Donald Spoto",3.83,990,"en-US",608,1999,"Da Capo Press","Performing Arts",97,"Arts & Culture"
"The Meanest Thing To Say","Bill Cosby/Varnette P. Honeywood/Varnette Hon Eywood",3.54,990,"eng",40,1997,"Cartwheel","Juvenile Fiction",55,"Young Adult and Children Fiction"
"Dream Makers: Untamed / Less of a Stranger","Nora Roberts",3.8,989,"eng",411,2006,"Silhouette Books","Fiction",32,"Fiction"
"The Nature of Space and Time","Stephen Hawking/Roger Penrose",4.09,989,"eng",152,2000,"Princeton University Press","Science",40,"Technology, Science & Animals"
"Narrative of the Life of Frederick Douglass  an American Slave / Incidents in the Life of a Slave Girl","Frederick Douglass/Harriet Ann Jacobs/Kwame Anthony Appiah",4.01,986,"eng",464,2004,"Modern Library","Biography & Autobiography",93,"Biography & Autobiography"
"From Far Away  Vol. 14","Kyoko Hikawa/Yuko Sawada/Freeman Wong",4.5,986,"eng",208,2007,"VIZ Media","Comics & Graphic Novels",37,"Other"
"Hikaru no Go  Vol. 8: The Pro Test Preliminaries: Day Four (Hikaru no Go  #8)","Yumi Hotta/Takeshi Obata",4.22,985,"eng",205,2006,"VIZ Media LLC","Comics & Graphic Novels",15,"Other"
"Teleny or the Reverse of the Medal","Oscar Wilde",3.67,985,"eng",138,2006,"MONDIAL","Fiction",63,"Fiction"
"Hard News (Rune  #3)","Jeffery Deaver",3.46,982,"eng",304,2001,"Bantam","Fiction",52,"Fiction"
"Henry Miller on Writing","Henry Miller/Thomas H. Moore",4.22,981,"eng",217,1964,"New Directions Publishing","Literary Criticism",52,"Fiction"
"The Interpreter","Suki Kim",3.56,976,"eng",304,2004,"St. Martins Press","Fiction",106,"Fiction"
"Hoodwinked","Quentin Carter",4.43,976,"en-US",277,2005,"Triple Crown Publications","Fiction",30,"Fiction"
"The Plague","Albert Camus/Robin Buss",3.98,975,"eng",238,2002,"Penguin","Epidemics",80,"Health, Personal Development & Relationships"
"Shroud (The Cleave Trilogy #2)","John Banville",3.66,974,"eng",257,2004,"Vintage","Fiction",81,"Fiction"
"Fanny: Being the True History of the Adventures of Fanny Hackabout-Jones","Erica Jong",3.79,971,"eng",512,2003,"W. W. Norton  Company","Fiction",71,"Fiction"
"Nightmare House (Harrow House  #1)","Douglas Clegg",3.36,971,"en-GB",340,2004,"Leisure Books","Fiction",101,"Fiction"
"The Inner Reaches of Outer Space: Metaphor as Myth and as Religion (Collected Worksl)","Joseph Campbell",4.22,971,"en-GB",160,2002,"New World Library","Religion",49,"Religious & Spiritual"
"Cod: A Biography of the Fish That Changed the World","Mark Kurlansky",3.91,970,"eng",294,1998,"Penguin Books","History",104,"History & Historical Fiction"
"The Wit and Wisdom of Mark Twain","Mark Twain",4.2,970,"eng",64,1998,"Dover Publications","Literary Criticism",53,"Fiction"
"Oh  The Places You’ll Go!","Dr. Seuss",4.35,969,"eng",48,2003,"HarperCollinsChildren’sBooks","Adventure stories",75,"Fantasy & Science Fiction"
"Going Postal (Discworld  #33)","Terry Pratchett",4.38,969,"en-US",377,2004,"Harper","Fiction",114,"Fiction"
"The Doctor is Sick","Anthony Burgess",3.62,966,"eng",260,1997,"W.W. Norton  Company","Fiction",39,"Fiction"
"For the Sins of My Father: A Mafia Killer  His Son  and the Legacy of a Mob Life","Albert Demeo/Mary Jane Ross",4.05,966,"eng",288,2003,"Broadway Books","Biography & Autobiography",108,"Biography & Autobiography"
"Bridget Jones: The Edge Of Reason (Bridget Jones #2)","Helen Fielding",3.57,965,"eng",422,1999,"Picador  Macmillan Publishers Ltd","Diary fiction",49,"Fiction"
"Mayflower Treasure Hunt (A to Z Mysteries: Super Edition  #2)","Ron Roy/John Steven Gurney",4.19,965,"en-US",114,2007,"Random House Books for Young Readers","Juvenile Fiction",39,"Young Adult and Children Fiction"
"Koko's Kitten","Francine Patterson/Ronald H. Cohn",4.3,963,"eng",32,1987,"Scholastic Press","Juvenile Nonfiction",92,"Young Adult and Children Fiction"
"The War","Marguerite Duras/Barbara Bray",3.85,963,"eng",192,1994,"The New Press","Biography & Autobiography",65,"Biography & Autobiography"
"A New Collection of Three Complete Novels: Congo / Sphere / Eaters of the Dead","Michael Crichton",3.99,960,"eng",720,1994,"Wings Books","Fiction",27,"Fiction"
"The Turn of the Screw/Daisy Miller","Henry James",3.61,959,"eng",192,1954,"Laurel","Popular literature",55,"Fiction"
"Victoria Line  Central Line","Maeve Binchy",3.6,957,"eng",432,2006,"Arrow","London (England)",53,"Travel & Places"
"The Trial of God: (as it was held on February 25  1649  in Shamgorod)","Elie Wiesel/Robert McAfee Brown/Matthew Fox",4.14,957,"eng",208,1995,"Schocken","Fiction",72,"Fiction"
"Steamed (A Gourmet Girl Mystery  #1)","Jessica Conant-Park/Susan Conant",3.45,956,"eng",320,2007,"Berkley","Fiction",93,"Fiction"
"Drop The Rock: Removing Character Defects - Steps Six and Seven","Bill Pittman/Todd W. Hall/Sara S./Todd W.",4.44,955,"en-US",132,2005,"Hazelden Publishing","Self-Help",41,"Health, Personal Development & Relationships"
"Worlds Enough & Time: Five Tales of Speculative Fiction","Dan Simmons",3.75,953,"eng",272,2002,"Harper Voyager","Fiction",61,"Fiction"
"Wookiee Cookies: A Star Wars Cookbook","Robin  Davis/Frankie Frankeny",3.93,952,"eng",132,1998,"Chronicle Books","Cooking",57,"Health, Personal Development & Relationships"
"Mr. Ives' Christmas","Oscar Hijuelos",3.76,949,"eng",256,2003,"Harper Perennial","Fiction",128,"Fiction"
"Texas! Trilogy","Sandra Brown",4.29,949,"eng",600,1992,"Doubleday Books","Fiction",39,"Fiction"
"Catching Alice","Clare Naylor",3.38,948,"en-US",328,2000,"Ballantine Books","Fiction",27,"Fiction"
"The Nuclear Age","Tim O'Brien",3.45,945,"eng",320,1996,"Penguin Books","Fiction",61,"Fiction"
"Cousin Pons","Honoré de Balzac/Herbert J. Hunt",3.98,942,"eng",336,1978,"Penguin Classics","Fiction",48,"Fiction"
"A Matter of Trust (Justice  #0)","Radclyffe",4.21,942,"eng",240,2006,"Bold Strokes Books","Fiction",26,"Fiction"
"Notebook of a Return to the Native Land","Aimé Césaire/Annette Smith/Clayton Eshleman",4.09,941,"eng",66,2001,"Wesleyan University Press","Literary Criticism",49,"Fiction"
"The Devilish Pleasures of a Duke (Boscastle  #6)","Jillian Hunter",3.99,938,"eng",345,2007,"Ballantine Books","Fiction",46,"Fiction"
"The Awakening","Kate Chopin/Margo Culley",3.65,937,"eng",336,1993,"W. W. Norton & Company","Fiction",72,"Fiction"
"Toast  and Other Stories","Charles Stross",3.8,935,"eng",247,2005,"Cosmos Books (OH)","Comics & Graphic Novels",34,"Other"
"Labyrinths: Selected Stories and Other Writings","Jorge Luis Borges/James E. Irby/Donald A. Yates/André Maurois",4.46,934,"eng",287,2000,"Penguin","Classical fiction",82,"Fiction"
"Gulliver's Travels","Martin Woodside/Jamel Akib/Arthur Pober/Jonathan Swift",3.97,933,"eng",160,2006,"Sterling","Juvenile Fiction",26,"Young Adult and Children Fiction"
"Whores for Gloria","William T. Vollmann",3.69,932,"en-US",160,1994,"Penguin Books","Fiction",111,"Fiction"
"Asylum (Blackstone Chronicles  #6)","John Saul",4.1,932,"eng",97,1997,"Fawcett","Fiction",24,"Fiction"
"From Socrates to Sartre: The Philosophic Quest","T.Z. Lavine",3.94,932,"eng",426,1985,"Bantam","Philosophy",70,"Social Sciences & Philosophy"
"Star Wars Tales  Vol. 1","Dave Land/Peter David/Dave Cooper/Dan Jolley/Doug Wheatley/Tom Fowler/Kilian Plunkett/Sean Phillips/Ryder Windham/John Ostrander/Jan Duursema/Timothy Zahn/Darko Macan/Rich Handley/Igor Kordey/Ron Marz/Rich Hedden/Rick Leonardi/Claudio Castellini/Martin Egeland/Lovern Kindzierski/Chris Brunner/Peet Janes/Jim Woodring",3.89,932,"eng",220,2004,"Dark Horse Books","Comics & Graphic Novels",36,"Other"
"The Pat Hobby Stories","F. Scott Fitzgerald/Arnold Gingrich",3.56,927,"eng",192,1995,"Scribner","Fiction",100,"Fiction"
"The Mind Parasites","Colin Wilson",3.77,927,"en-GB",240,2005,"Monkfish Book Publishing","Fiction",90,"Fiction"
"Coffee at Luke's: An Unauthorized Gilmore Girls Gabfest","Jennifer Crusie/Leah Wilson/Gregory Stevenson",3.55,926,"eng",197,2007,"Smart Pop","Performing Arts",140,"Arts & Culture"
"The Complete C.S. Lewis Signature Classics","C.S. Lewis",4.61,925,"eng",746,2007,"HarperOne","Religion",40,"Religious & Spiritual"
"Neptune Noir: Unauthorized Investigations into Veronica Mars","Rob Thomas/Leah Wilson/Heather Havrilesky/Amy Berner/Lynne Edwards/John  Ramos/Alafair Burke/Chris McCubbin/Lawrence Watt-Evans/Lani Diane Rich/Geoff Klock/Judy Fitzwater/Evelyn Vaughn/Joyce Millman/Amanda Ann Klein/Kristen Kidder/Jesse Hassenger/Gwen Ellery/Misty Hook/Samantha Bornemann",3.63,925,"eng",224,2007,"Smart Pop","Performing Arts",112,"Arts & Culture"
"Vinyl Cafe Diaries (Vinyl Cafe  #4)","Stuart McLean",4.19,924,"eng",302,2003,"Penguin Books Canada","Canada",59,"Travel & Places"
"The Cognitive Style of PowerPoint: Pitching Out Corrupts Within","Edward R. Tufte",4.08,924,"en-US",31,2006,"Graphics Press","Computers",65,"Technology, Science & Animals"
"The Complete Novels of Jane Austen","Jane Austen",4.55,924,"eng",1431,2005,"Wordsworth Editions","England",28,"Travel & Places"
"Chop Shop (Bug Man  #2)","Tim Downs",4.22,923,"eng",352,2004,"Howard Books","Fiction",75,"Fiction"
"Bedlam's Edge (Bedlam's Bard  #8)","Mercedes Lackey/Rosemary Edghill",3.92,922,"en-US",384,2007,"Baen","Fiction",20,"Fiction"
"Something Fishy at Macdonald Hall (Macdonald Hall  #7)","Gordon Korman",4.06,919,"eng",208,2000,"Scholastic Paperbacks","Juvenile Fiction",13,"Young Adult and Children Fiction"
"The Second World War: A Complete History","Martin  Gilbert",4.2,919,"eng",928,2004,"Holt McDougal","History",44,"History & Historical Fiction"
"Midnight Brunch (Casa Dracula  #2)","Marta Acosta",3.8,919,"en-US",336,2007,"Gallery Books","Fiction",82,"Fiction"
