"Title","Authors","Average_Rating","Ratings_Count","Language_Code","Num_Pages","Publication_Date","Publisher","Categories","Text_Reviews_Count","Theme"
"Twilight (Twilight  #1)","Stephenie Meyer",3.59,4597666,"eng",501,2006,"Little  Brown and Company","Young Adult Fiction",94265,"Young Adult and Children Fiction"
"The Hobbit  or There and Back Again","J.R.R. Tolkien",4.27,2530894,"eng",366,2002,"Houghton Mifflin","Juvenile Fiction",32871,"Young Adult and Children Fiction"
"Angels & Demons (Robert Langdon  #1)","Dan Brown",3.89,2418736,"eng",736,2006,"Pocket Books","Fiction",21303,"Fiction"
"Harry Potter and the Prisoner of Azkaban (Harry Potter  #3)","J.K. Rowling/Mary GrandPré",4.56,2339585,"eng",435,2004,"Scholastic Inc.","Juvenile Fiction",36325,"Young Adult and Children Fiction"
"Harry Potter and the Chamber of Secrets (Harry Potter  #2)","J.K. Rowling/Mary GrandPré",4.42,2293963,"eng",341,1999,"Arthur A. Levine Books / Scholastic Inc.","Juvenile Fiction",34692,"Young Adult and Children Fiction"
"Harry Potter and the Order of the Phoenix (Harry Potter  #5)","J.K. Rowling/Mary GrandPré",4.49,2153167,"eng",870,2004,"Scholastic Inc.","Juvenile Fiction",29221,"Young Adult and Children Fiction"
"The Fellowship of the Ring (The Lord of the Rings  #1)","J.R.R. Tolkien",4.36,2128944,"eng",398,2003,"Houghton Mifflin Harcourt","Fiction",13670,"Fiction"
"Harry Potter and the Half-Blood Prince (Harry Potter  #6)","J.K. Rowling/Mary GrandPré",4.57,2095690,"eng",652,2006,"Scholastic Inc.","Juvenile Fiction",27591,"Young Adult and Children Fiction"
"Lord of the Flies","William Golding",3.68,2036679,"eng",182,1999,"Penguin Books","Fiction",26199,"Fiction"
"Romeo and Juliet","William Shakespeare/Paul Werstine/Barbara A. Mowat",3.74,1893917,"eng",368,2004,"Simon Schuster","Drama",14637,"Arts & Culture"
"The Da Vinci Code (Robert Langdon  #2)","Dan Brown",3.84,1679706,"eng",489,2006,"Anchor","Art museum curators",35877,"Arts & Culture"
"The Alchemist","Paulo Coelho/Alan R. Clarke/Özdemir İnce",3.86,1631221,"eng",197,1993,"HarperCollins","Fiction",55843,"Fiction"
"The Giver (The Giver  #1)","Lois Lowry",4.13,1585589,"eng",208,2006,"Ember","Juvenile Fiction",56604,"Young Adult and Children Fiction"
"Jane Eyre","Charlotte Brontë/Michael Mason",4.12,1409369,"eng",532,2003,"Penguin","Fiction",27884,"Fiction"
"Eat  Pray  Love","Elizabeth Gilbert",3.55,1362264,"eng",368,2007,"Riverhead Books","Biography & Autobiography",47620,"Biography & Autobiography"
"Charlotte's Web","E.B. White/Garth Williams/Rosemary Wells",4.17,1300470,"eng",184,2001,"HarperCollinsPublishers","Juvenile Fiction",14739,"Young Adult and Children Fiction"
"Water for Elephants","Sara Gruen",4.09,1260027,"eng",335,2007,"Algonquin Books","Fiction",52759,"Fiction"
"Brave New World","Aldous Huxley",3.99,1247221,"eng",288,1998,"HarperPerennial / Perennial Classics","Fiction",20014,"Fiction"
"The Curious Incident of the Dog in the Night-Time","Mark Haddon",3.88,1054308,"eng",226,2004,"Vintage","Fiction",35537,"Fiction"
"My Sister's Keeper","Jodi Picoult",4.07,986711,"eng",423,2005,"Washington Square Press","Fiction",29652,"Fiction"
"The Shining","Stephen King",4.22,978535,"eng",659,1980,"New English Library (Hodder & Stoughton)","Boys",15105,"Social Sciences & Philosophy"
"Holes (Holes  #1)","Louis Sachar",3.96,887554,"eng",233,2000,"Scholastic","Blind",17547,"Health, Personal Development & Relationships"
"The Glass Castle","Jeannette Walls",4.27,808656,"eng",288,2006,"Scribner","Biography & Autobiography",46176,"Biography & Autobiography"
"Dracula","Bram Stoker/Nina Auerbach/David J. Skal",3.99,774987,"eng",488,1986,"Norton","Fiction",14944,"Fiction"
"The Secret Garden","Frances Hodgson Burnett",4.13,764134,"eng",331,1998,"Children's Classics","Juvenile Fiction",11796,"Young Adult and Children Fiction"
"The Picture of Dorian Gray","Oscar Wilde/Jeffrey Eugenides",4.08,760717,"eng",272,2004,"Random House: Modern Library","Fiction",17179,"Fiction"
"The Devil Wears Prada (The Devil Wears Prada  #1)","Lauren Weisberger",3.74,744569,"eng",432,2006,"Anchor Books","Fiction",7247,"Fiction"
"The Princess Bride","William Goldman",4.26,703676,"eng",456,2003,"Ballantine Books","Fiction",13878,"Fiction"
"Outlander (Outlander  #1)","Diana Gabaldon",4.23,673350,"eng",850,2005,"Dell Publishing Company","Fiction",34690,"Fiction"
"A Clash of Kings  (A Song of Ice and Fire  #2)","George R.R. Martin",4.41,638766,"eng",969,2002,"Bantam","Fiction",16535,"Fiction"
"The Sea of Monsters (Percy Jackson and the Olympians  #2)","Rick Riordan",4.24,630511,"eng",279,2006,"Hyperion Books","Juvenile Fiction",19806,"Young Adult and Children Fiction"
"Anne of Green Gables (Anne of Green Gables  #1)","L.M. Montgomery",4.25,625759,"eng",320,2003,"Signet Book","Fiction",13883,"Fiction"
"Hamlet","William Shakespeare/Harold Bloom/Rex Gibson",4.02,609271,"eng",289,2005,"Cambridge University Press","Juvenile Nonfiction",7139,"Young Adult and Children Fiction"
"The Road","Cormac McCarthy",3.97,606433,"eng",241,2006,"Alfred A. Knopf","Fiction",34301,"Fiction"
"Macbeth","William Shakespeare",3.9,592315,"eng",249,2013,"Simon  Schuster","Drama",7791,"Arts & Culture"
"The Joy Luck Club","Amy Tan",3.92,565524,"eng",288,2006,"Penguin Books","Fiction",7255,"Fiction"
"Emma","Jane Austen/Fiona Stafford",4,549271,"eng",474,2003,"Penguin Books","Fiction",11117,"Fiction"
"The Firm","Robin Waterfield/John Grisham",4.01,540910,"eng",76,2000,"Addison Wesley Publishing Company","Fiction",3378,"Fiction"
"Middlesex","Jeffrey Eugenides",4,540349,"eng",529,2003,"Picador USA","Fiction",19548,"Fiction"
"The Memory Keeper's Daughter","Kim Edwards",3.67,535636,"eng",401,2006,"Penguin Books","Fiction",17550,"Fiction"
"The Red Tent","Anita Diamant",4.17,470858,"eng",336,2005,"St. Martin's Press","Fiction",15859,"Fiction"
"Something Borrowed (Darcy & Rachel  #1)","Emily Giffin",3.85,454917,"eng",322,2004,"St. Martin's Press","Fiction",7487,"Fiction"
"The Color Purple","Alice Walker",4.2,445206,"eng",295,2004,"Pocket","Fiction",9643,"Fiction"
"Persuasion","Jane Austen/James Kinsley/Anna Massey/Richard S. Hartmetz/Maurgaux Motin/Deidre Shauna Lynch",4.14,441462,"eng",249,2004,"Oxford University Press","Fiction",11308,"Fiction"
"The 7 Habits of Highly Effective People: Powerful Lessons in Personal Change","Stephen R. Covey/Jim Collins",4.1,431987,"eng",372,2004,"Free Press","Self-Help",7024,"Health, Personal Development & Relationships"
"Marley and Me: Life and Love With the World's Worst Dog","John Grogan",4.13,414947,"eng",291,2005,"William Morrow; 1ST edition","Labrador retriever",12116,"Technology, Science & Animals"
"Coraline","Neil Gaiman/Dave McKean",4.06,403622,"eng",162,2006,"William Morrow Paperbacks","Fiction",13096,"Fiction"
"Marked (House of Night  #1)","P.C. Cast/Kristin Cast",3.8,399152,"eng",306,2007,"St. Martin's Press","Juvenile Fiction",12748,"Young Adult and Children Fiction"
"Fight Club","Chuck Palahniuk",4.19,388782,"eng",218,2005,"W.W. Norton & Company (NYC)","Fiction",9654,"Fiction"
"The Client","John Grisham",4,367399,"eng",483,2010,"Delta","Fiction",1978,"Fiction"
"Into Thin Air: A Personal Account of the Mount Everest Disaster","Jon Krakauer",4.17,351406,"eng",368,1999,"Anchor Books","Biography & Autobiography",11701,"Biography & Autobiography"
"A Tree Grows in Brooklyn","Betty  Smith",4.26,345283,"eng",496,2006,"HarperCollins Publishers","Fiction",16114,"Fiction"
"The Pelican Brief","John Grisham",4,340714,"eng",400,2006,"Delta","Fiction",1942,"Fiction"
"Flowers for Algernon","Daniel Keyes",4.12,337596,"eng",311,2005,"Harvest Books","Fiction",9949,"Fiction"
"Extremely Loud and Incredibly Close","Jonathan Safran Foer",3.98,335477,"eng",326,2006,"Mariner Books","Fiction",19241,"Fiction"
"Love in the Time of Cholera","Gabriel García Márquez/Edith Grossman",3.91,324487,"eng",348,2003,"Vintage International","Fiction",13070,"Fiction"
"Inkheart (Inkworld  #1)","Cornelia Funke/Anthea Bell",3.88,324482,"eng",563,2005,"Scholastic Paperbacks","Juvenile Fiction",9360,"Young Adult and Children Fiction"
"Atlas Shrugged","Ayn Rand/Leonard Peikoff",3.69,322483,"eng",1168,1999,"Plume","Capitalism",14702,"Education, Business & Economics"
"Who Moved My Cheese?","Spencer Johnson/Kenneth H. Blanchard",3.8,311436,"eng",96,2002,"Vermilion","Self-Help",8421,"Health, Personal Development & Relationships"
"A Walk in the Woods: Rediscovering America on the Appalachian Trail","Bill Bryson",4.06,308840,"eng",397,2006,"Anchor Books","Sports & Recreation",14993,"Health, Personal Development & Relationships"
"She's Come Undone","Wally Lamb",3.88,294348,"eng",465,1998,"Pocket","Fiction",9096,"Fiction"
"Stardust","Neil Gaiman",4.08,283274,"eng",248,2006,"Harper Perennial","Fiction",11746,"Fiction"
"John Adams","David McCullough",4.06,282649,"eng",751,2001,"Simon & Schuster Paperbacks","Biography & Autobiography",5325,"Biography & Autobiography"
"Beloved","Toni Morrison",3.83,282045,"eng",324,2004,"Vintage","Fiction",9004,"Fiction"
"Goodnight Moon","Margaret Wise Brown/Clement Hurd",4.28,276426,"eng",32,2007,"HarperCollins","Juvenile Fiction",4975,"Young Adult and Children Fiction"
"The Call of the Wild","Jack London/Avi",3.86,274649,"eng",172,2001,"Scholastic","Juvenile Fiction",7203,"Young Adult and Children Fiction"
"Othello","William Shakespeare",3.89,273070,"eng",314,2004,"Simon  Schuster","Drama",4265,"Arts & Culture"
"1st to Die (Women's Murder Club  #1)","James Patterson",4.08,269826,"eng",424,2005,"Grand Central Publishing","Fiction",5220,"Fiction"
"The Lorax","Dr. Seuss",4.35,260054,"eng",72,1998,"Random House Books for Young Readers","Juvenile Fiction",3532,"Young Adult and Children Fiction"
"Dark Lover (Black Dagger Brotherhood  #1)","J.R. Ward",4.2,259511,"eng",393,2005,"Penguin Group (USA)","Fiction",10475,"Fiction"
"The Runaway Jury","John Grisham",3.98,249884,"eng",358,2006,"Delta","Fiction",1691,"Fiction"
"The Ultimate Hitchhiker's Guide to the Galaxy (Hitchhiker's Guide to the Galaxy  #1-5)","Douglas Adams",4.38,249558,"eng",815,2002,"Del Rey Books","Fiction",4080,"Fiction"
"The Unbearable Lightness of Being","Milan Kundera/Michael Henry Heim",4.1,248686,"eng",320,2009,"Harper Perennial","Adultery",8251,"Social Sciences & Philosophy"
"A Short History of Nearly Everything","Bill Bryson",4.21,248558,"eng",544,2004,"Broadway Books","Science",9396,"Technology, Science & Animals"
"The Pact","Jodi Picoult",4.01,244774,"eng",512,2006,"Avon","Fiction",8841,"Fiction"
"Mere Christianity","C.S. Lewis",4.32,240060,"eng",191,1996,"Touchstone Books","Religion",5828,"Religious & Spiritual"
"A Brief History of Time","Stephen Hawking",4.17,239652,"eng",212,1998,"Bantam Books","Science",5860,"Technology, Science & Animals"
"A Little Princess","Frances Hodgson Burnett/Nancy Bond",4.2,238192,"eng",242,2002,"Penguin Books","Fiction",4392,"Fiction"
"I  Robot (Robot  #0.1)","Isaac Asimov",4.19,238100,"eng",224,2004,"Spectra","Fiction",4196,"Fiction"
"The Amber Spyglass  (His Dark Materials  #3)","Philip Pullman",4.09,237072,"eng",467,2003,"Laurel Leaf","Juvenile Fiction",6358,"Young Adult and Children Fiction"
"The Art of War","Sun Tzu/Thomas Cleary/Pulat Otkan/Giray Fidan",3.97,235924,"eng",273,2005,"Shambhala","Philosophy",5869,"Social Sciences & Philosophy"
"A Streetcar Named Desire","Tennessee Williams",3.98,235224,"eng",107,1952,"Dramatists Play Service","Drama",2409,"Arts & Culture"
"Odd Thomas (Odd Thomas  #1)","Dean Koontz",3.97,227884,"eng",446,2006,"Bantam","FICTION",6253,"Fiction"
"Kafka on the Shore","Haruki Murakami/Philip Gabriel",4.14,225397,"eng",467,2006,"Vintage International","Fiction",12452,"Fiction"
"Dragonfly in Amber (Outlander  #2)","Diana Gabaldon",4.32,222140,"eng",743,2001,"Bantam","Fiction",11121,"Fiction"
"Their Eyes Were Watching God","Zora Neale Hurston",3.91,220309,"eng",219,2006,"Amistad","Fiction",9536,"Fiction"
"The Princess Diaries (The Princess Diaries  #1)","Meg Cabot",3.78,216359,"eng",283,2001,"Turtleback","Juvenile Fiction",4137,"Young Adult and Children Fiction"
"The Namesake","Jhumpa Lahiri",3.99,213178,"eng",291,2004,"Mariner Books","Fiction",10160,"Fiction"
"War and Peace","Leo Tolstoy/Henry Gifford/Aylmer Maude/Louise Maude",4.11,211671,"eng",1392,1998,"Oxford University Press","Fiction",6245,"Fiction"
"The No. 1 Ladies' Detective Agency (No. 1 Ladies' Detective Agency #1)","Alexander McCall Smith",3.78,208669,"eng",235,2003,"Anchor Books","Fiction",9489,"Fiction"
"Cold Mountain","Charles Frazier",3.86,208001,"eng",356,2006,"Grove Press","Fiction",4972,"Fiction"
"A Million Little Pieces","James Frey",3.65,206011,"eng",515,2005,"Anchor Books","Biography & Autobiography",10821,"Biography & Autobiography"
"Wizard's First Rule (Sword of Truth  #1)","Terry Goodkind",4.13,204648,"eng",836,2003,"Tor Books","Fiction",4986,"Fiction"
"Maus I: A Survivor's Tale: My Father Bleeds History (Maus  #1)","Art Spiegelman",4.34,203013,"eng",159,1991,"Pantheon Books","Children of Holocaust survivors",4873,"History & Historical Fiction"
"The Andromeda Strain (Andromeda  #1)","Michael Crichton",3.89,202043,"eng",327,2003,"Avon Books","Fiction",2850,"Fiction"
"Little House in the Big Woods (Little House  #1)","Laura Ingalls Wilder/Garth Williams",4.18,201840,"eng",198,2007,"HarperTrophy","Juvenile Fiction",3463,"Young Adult and Children Fiction"
"The Good Earth (House of Earth  #1)","Pearl S. Buck",3.98,200744,"eng",418,2009,"Howard Publishing Co","Fiction",7656,"Fiction"
"Voyager (Outlander  #3)","Diana Gabaldon",4.39,198818,"eng",870,2001,"Delta","Fiction",8130,"Fiction"
"Something Blue (Darcy & Rachel  #2)","Emily Giffin",3.93,191577,"en-US",338,2006,"Griffin","Fiction",6599,"Fiction"
"The Brothers Karamazov","Fyodor Dostoyevsky/Fyodor Dostoevsky/Richard Pevear/Larissa Volokhonsky",4.32,191531,"eng",796,2002,"Farrar  Straus and Giroux","Fiction",6795,"Fiction"
"The Hound of the Baskervilles","Arthur Conan Doyle/Anne Perry/Sidney Paget",4.11,191128,"eng",256,2001,"Signet","Fiction",4802,"Fiction"
"Left Behind (Left Behind  #1)","Tim LaHaye/Jerry B. Jenkins",3.83,189090,"eng",342,2000,"Tyndale House Publishers","Fiction",3293,"Fiction"
"Snow Crash","Neal Stephenson/Guy Abadia",4.03,188100,"eng",438,2000,"Bantam Books","Fiction",6612,"Fiction"
"The Angel Experiment (Maximum Ride  #1)","James Patterson",4.08,187892,"eng",445,2006,"Grand Central Publishing","Fiction",7624,"Fiction"
"The Dragon Reborn (The Wheel of Time  #3)","Robert Jordan",4.25,183950,"eng",624,2002,"Tor Books","Fiction",2671,"Fiction"
"Kitchen Confidential: Adventures in the Culinary Underbelly","Anthony Bourdain",4.07,183882,"eng",312,2007,"Ecco/Harper Perennial","Biography & Autobiography",9427,"Biography & Autobiography"
"The Complete Stories and Poems","Edgar Allan Poe",4.38,183869,"eng",821,1984,"Doubleday & Company  Inc.","Fiction",1226,"Fiction"
"The Prince of Tides","Pat Conroy",4.24,178717,"eng",679,2002,"Dial Press Trade Paperback","Fiction",3473,"Fiction"
"Mrs. Dalloway","Virginia Woolf/Maureen Howard",3.79,176190,"eng",194,2002,"Houghton Mifflin Harcourt","Fiction",5595,"Fiction"
"A Separate Peace","John Knowles/David Levithan",3.57,175779,"eng",208,2003,"Scribner","Fiction",6261,"Fiction"
"The Drawing of the Three (The Dark Tower  #2)","Stephen King",4.23,173022,"eng",463,2003,"Signet","Fiction",5139,"Fiction"
"Preludes & Nocturnes (The Sandman  #1)","Neil Gaiman/Sam Kieth/Mike Dringenberg/Malcolm Jones III/Todd Klein/Karen  Berger",4.24,171841,"eng",233,1998,"Vertigo","Comics & Graphic Novels",3781,"Other"
"Patriot Games (Jack Ryan  #1)","Tom Clancy",4.14,170797,"eng",503,1992,"Berkley","Ryan, Jack (Fictitious character)",984,"Other"
"The Canterbury Tales","Geoffrey Chaucer/Nevill Coghill",3.49,168559,"eng",504,2003,"Penguin Classics","Poetry",2365,"International Literature & Poetry"
"Nickel and Dimed: On (Not) Getting by in America","Barbara Ehrenreich",3.63,168362,"eng",240,2002,"Owl Books (Henry Holt)","Business & Economics",5762,"Education, Business & Economics"
"The Trial","Franz Kafka/Max Brod/Willa Muir/Edwin Muir",3.98,168300,"eng",255,2001,"Vintage","Fiction",3724,"Fiction"
"1776","David McCullough",4.07,166916,"eng",386,2006,"Simon  Schuster","Biography & Autobiography",6243,"Biography & Autobiography"
"Life  the Universe and Everything (Hitchhiker's Guide to the Galaxy  #3)","Douglas Adams",4.2,166574,"eng",224,2005,"Del Rey","Fiction",2192,"Fiction"
"Zen and the Art of Motorcycle Maintenance: An Inquiry Into Values (Phaedrus  #1)","Robert M. Pirsig",3.77,166046,"eng",540,2006,"HarperTorch","Psychology",6446,"Social Sciences & Philosophy"
"Howl's Moving Castle (Howl's Moving Castle  #1)","Diana Wynne Jones",4.29,161582,"eng",329,2001,"Harper Trophy","Juvenile Fiction",9026,"Young Adult and Children Fiction"
"The Power of Now: A Guide to Spiritual Enlightenment","Eckhart Tolle",4.13,159883,"eng",229,2004,"New World Library","Body, Mind & Spirit",7012,"Health, Personal Development & Relationships"
"The Vampire Lestat (The Vampire Chronicles  #2)","Anne Rice",4.07,156354,"eng",481,2004,"Ballantine Books","Fiction",2720,"Fiction"
"Scott Pilgrim  Volume 1: Scott Pilgrim's Precious Little Life","Bryan Lee O'Malley",4.17,155863,"eng",168,2004,"Oni Press","Comics & Graphic Novels",3267,"Other"
"Lover Eternal (Black Dagger Brotherhood  #2)","J.R. Ward",4.35,155348,"eng",464,2006,"Signet","Fiction",5325,"Fiction"
"Thinner","Richard Bachman/Stephen King",3.71,155020,"eng",320,1996,"Signet","Allegories",1513,"Education, Business & Economics"
"The Rainmaker","John Grisham",3.94,151818,"eng",419,2005,"Delta","Fiction",1489,"Fiction"
"The Shadow Rising (The Wheel of Time  #4)","Robert Jordan",4.24,148074,"eng",1007,1993,"Tom Doherty Tor Fantasy","Fiction",2471,"Fiction"
"The Guardian","Nicholas Sparks",4.15,148042,"eng",400,2005,"Grand Central Publishing","Fiction",4193,"Fiction"
"Pippi Longstocking","Astrid Lindgren/Florence Lamborn/Louis S. Glanzman",4.13,147067,"eng",160,2005,"Puffin Books","Juvenile Fiction",2558,"Young Adult and Children Fiction"
"Animal Farm / 1984","George Orwell/Christopher Hitchens",4.28,146659,"eng",400,2003,"Houghton Mifflin Harcourt","Fiction",1625,"Fiction"
"The Waste Lands (The Dark Tower  #3)","Stephen King/Ned Dameron",4.24,145740,"eng",422,2003,"Viking Adult","",3382,"Other"
"Murder on the Orient Express (Hercule Poirot  #10)","Agatha Christie",4.17,145660,"eng",322,2004,"Berkley","Fiction",5711,"Fiction"
"Lover Awakened (Black Dagger Brotherhood  #3)","J.R. Ward",4.45,144906,"eng",448,2006,"Signet","Fiction",5728,"Fiction"
"Congo","Michael Crichton",3.59,144636,"eng",442,2003,"Avon Books","Fiction",1546,"Fiction"
"Twenty Thousand Leagues Under the Sea (Extraordinary Voyages  #6)","Jules Verne/Anthony Bonner",3.88,142879,"eng",394,2002,"Barnes & Noble","Science fiction",3087,"Fantasy & Science Fiction"
"The Tale of Despereaux","Kate DiCamillo/Timothy Basil Ering",4.04,142149,"eng",267,2008,"Candlewick Press","Animals",8457,"Technology, Science & Animals"
"Baby Proof","Emily Giffin",3.72,140762,"eng",340,2006,"St. Martin's Press","Fiction",3096,"Fiction"
"The Hunchback of Notre-Dame","Victor Hugo/Walter J. Cobb",4,140529,"eng",510,2001,"Signet Classics","Fiction",2558,"Fiction"
"The Bone Collector (Lincoln Rhyme  #1)","Jeffery Deaver",4.19,140014,"eng",528,1998,"Signet Book","Fiction",1753,"Fiction"
"Julius Caesar","William Shakespeare/Roma Gill",3.68,138685,"eng",128,2002,"Oxford University Press  USA","Juvenile Nonfiction",2595,"Young Adult and Children Fiction"
"Twelfth Night","William Shakespeare",3.98,138101,"eng",272,2004,"Simon Schuster","Drama",2513,"Arts & Culture"
"The Constant Princess (The Plantagenet and Tudor Novels  #6)","Philippa Gregory",3.9,136931,"eng",390,2006,"Washington Square Press","Fiction",3915,"Fiction"
"The Republic","Plato/Desmond Lee/Maria Helena da Rocha Pereira/Benjamin Jowett",3.94,136467,"eng",416,2003,"Penguin Classics","Philosophy",2013,"Social Sciences & Philosophy"
"Lamb: The Gospel According to Biff  Christ's Childhood Pal","Christopher Moore",4.25,135109,"eng",444,2004,"William Morrow / HarperCollins / Harper Perennial","Fiction",10380,"Fiction"
"Shutter Island","Dennis Lehane",4.09,134985,"eng",369,2004,"HarperTorch","Fiction",6300,"Fiction"
"Team of Rivals: The Political Genius of Abraham Lincoln","Doris Kearns Goodwin",4.28,133840,"eng",916,2006,"Simon & Schuster","Biography & Autobiography",6118,"Biography & Autobiography"
"The Corrections","Jonathan Franzen",3.79,133237,"eng",653,2002,"Fourth Estate Paperbacks","Aged women",7468,"Social Sciences & Philosophy"
"Gathering Blue (The Giver  #2)","Lois Lowry",3.82,132584,"eng",240,2000,"Delacorte Press","Juvenile Fiction",9341,"Young Adult and Children Fiction"
"The Bluest Eye","Toni Morrison",4.03,132233,"eng",216,2005,"Plume","Fiction",5507,"Fiction"
"Veronika Decides to Die","Paulo Coelho/Margaret Jull Costa/Kâmuran Şipal",3.7,132064,"eng",210,2006,"Harper Perennial","Fiction",5452,"Fiction"
"Men Are from Mars  Women Are from Venus","John Gray",3.55,132062,"eng",368,2012,"Harper Paperbacks","Family & Relationships",3303,"Health, Personal Development & Relationships"
"Suzanne's Diary for Nicholas","James Patterson",4.17,131662,"eng",289,2003,"Vision","Fiction",4267,"Fiction"
"Brave New World / Brave New World Revisited","Aldous Huxley/Christopher Hitchens",4.16,129179,"eng",340,2005,"Harper Perennial Modern Classics","Fiction",1047,"Fiction"
"The Fiery Cross (Outlander  #5)","Diana Gabaldon/Janos Farkas",4.27,128901,"eng",1443,2005,"Dell","Fiction",5294,"Fiction"
"Different Seasons","Stephen King",4.35,127648,"eng",560,1995,"Warner Books","Castle Rock (Me. : Imaginary place)",2080,"Fantasy & Science Fiction"
"The Alienist (Dr. Laszlo Kreizler  #1)","Caleb Carr",4.06,126669,"eng",498,2006,"Random House","Fiction",5578,"Fiction"
"Cloudy With a Chance of Meatballs (Cloudy with a Chance of Meatballs  #1)","Judi Barrett/Ron Barrett",4.16,124141,"eng",32,1982,"Atheneum Books for Young Readers","Juvenile Fiction",2038,"Young Adult and Children Fiction"
"The Queen of the Damned (The Vampire Chronicles  #3)","Anne Rice",3.89,121794,"eng",448,1997,"Ballantine Books","Fiction",1667,"Fiction"
"Murder at the Vicarage (Miss Marple  #1)","Agatha Christie",4.05,121099,"eng",288,2006,"Black Dog & Leventhal Publishers","Fiction",2237,"Fiction"
"No Country for Old Men","Cormac McCarthy",4.14,120421,"eng",309,2006,"Vintage","Fiction",6140,"Fiction"
"Xenocide (Ender's Saga  #3)","Orson Scott Card/Piotr W. Cholewa",3.79,119937,"eng",592,1996,"Tor Books","Fiction",3139,"Fiction"
"Four to Score (Stephanie Plum  #4)","Janet Evanovich",4.17,117541,"eng",313,1999,"St. Martin's Press","Fiction",2502,"Fiction"
"Fablehaven (Fablehaven  #1)","Brandon Mull",4.1,117341,"eng",351,2006,"Shadow Mountain","Juvenile Fiction",8718,"Young Adult and Children Fiction"
"The Screwtape Letters","C.S. Lewis",4.22,116834,"eng",224,2001,"HarperCollins","Religion",4746,"Religious & Spiritual"
"Guilty Pleasures (Anita Blake  Vampire Hunter  #1)","Laurell K. Hamilton",4.02,115364,"eng",355,2004,"Berkley","Fiction",4037,"Fiction"
"A Beautiful Mind","Sylvia Nasar",4.13,115201,"eng",461,2002,"Faber  Faber","Mathematicians",1008,"Technology, Science & Animals"
"Einstein: His Life and Universe","Walter Isaacson",4.11,113315,"eng",675,2007,"Simon  Schuster","Biography & Autobiography",2833,"Biography & Autobiography"
"The Fires of Heaven (The Wheel of Time  #5)","Robert Jordan",4.16,113052,"eng",912,1994,"Orbit","Juvenile Nonfiction",1673,"Young Adult and Children Fiction"
"The Deep End of the Ocean (Cappadora Family  #1)","Jacquelyn Mitchard",3.87,112856,"eng",464,1999,"Penguin Books","Fiction",1028,"Fiction"
"A Fine Balance","Rohinton Mistry",4.36,112196,"eng",603,2001,"Vintage","Fiction",7546,"Fiction"
"The Complete Maus","Art Spiegelman",4.55,111475,"eng",296,2003,"Penguin Books","Children of Holocaust survivors",5966,"History & Historical Fiction"
"Anthem","Ayn Rand",3.63,110952,"eng",105,1999,"NAL","Fiction",7277,"Fiction"
"The Jungle","Upton Sinclair/Earl Lee/Kathleen DeGrave",3.74,110423,"eng",335,2003,"See Sharp Press","Fiction",4133,"Fiction"
"The Dark Half","Stephen King",3.77,110131,"eng",469,1990,"New English Library","English fiction",1282,"Fiction"
"The History of Love","Nicole Krauss",3.92,110082,"eng",255,2006,"Norton","Fiction",9777,"Fiction"
"The Invisible Man","H.G. Wells",3.64,109551,"eng",192,2002,"Signet Classics","Fiction",3892,"Fiction"
"Mystic River","Dennis Lehane",4.18,109447,"eng",416,2001,"William Morrow Paperbacks","Fiction",2859,"Fiction"
"Lord of Chaos (The Wheel of Time  #6)","Robert Jordan",4.13,109234,"eng",1011,1995,"Tor Books","Fiction",1962,"Fiction"
"The Forever War (The Forever War  #1)","Joe Haldeman",4.15,108783,"eng",278,2003,"Voyager","Fiction",4005,"Fiction"
"The Bonesetter's Daughter","Amy Tan",3.99,108440,"eng",387,2003,"Ballantine Books","Fiction",2689,"Fiction"
"The Woman in White","Wilkie Collins/Matthew Sweet",4,108060,"eng",672,2003,"Penguin Classics","Fiction",5168,"Fiction"
"Blindness","José Saramago/Giovanni Pontiero",4.11,107455,"eng",326,1999,"Mariner Books","Fiction",7778,"Fiction"
"Journey to the Center of the Earth (Extraordinary Voyages  #3)","Jules Verne",3.86,107189,"eng",240,2006,"Bantam","Fiction",2510,"Fiction"
"A Crown of Swords (The Wheel of Time  #7)","Robert Jordan",4.04,106712,"eng",880,1997,"Tor Books","Fiction",1604,"Fiction"
"Surely You're Joking  Mr. Feynman!: Adventures of a Curious Character","Richard P. Feynman",4.28,106526,"eng",391,1997,"W. W. Norton & Company","Biography & Autobiography",3685,"Biography & Autobiography"
"Reading Lolita in Tehran: A Memoir in Books","Azar Nafisi",3.61,106493,"eng",356,2003,"Random House Trade Paperbacks","Biography & Autobiography",6561,"Biography & Autobiography"
